id;source;created_date;is_retweet;text;text_retweet;language;hashtags;mentions;location;geo_location;geo_country;geo_coordinates;user_created_at;screen_name;name;profile_description;total_number_of_tweets;is_verified;followers_count;friends_count;retweets_count;favorite_count;url;listed_count;default_profile;default_profile_image;has_extended_profile;language_desc;tweet_full;pre_proc_tweet;stop_filter_tweet;pos_tags;stem_filter;lemma_filter
59513;twitter;1/14/18 7:39;FALSE;This #metoo movement makes me skeptical. A woman makes allegation, and the guy's career will be ruined because it's always guilty until proven innocent and trial by social media.;;en;metoo;;La Belle Aurore;;;;2/3/14 13:26;fikrisuhadi;roderick jaynes.;Mumbler of films, writer of unpublished works and occasionally cursing at Chelsea FC.;58706;False;1361;347;0;0;;23;True;False;True;english;this #metoo movement makes me skeptical. a woman makes allegation, and the guy's career will be ruined because it is always guilty until proven innocent and trial by social media.;this  movement makes me skeptical. a woman makes allegation, and the guy's career will be ruined because it is always guilty until proven innocent and trial by social media.;movement makes skeptical . woman makes allegation , guy 's career ruined always guilty proven innocent trial social media . ;"[('movement', 'NN'), ('makes', 'VBZ'), ('skeptical', 'JJ'), ('.', '.'), ('woman', 'NN'), ('makes', 'VBZ'), ('allegation', 'NN'), (',', ','), ('guy', 'NN'), (""'s"", 'POS'), ('career', 'NN'), ('ruined', 'VBD'), ('always', 'RB'), ('guilty', 'JJ'), ('proven', 'JJ'), ('innocent', 'JJ'), ('trial', 'NN'), ('social', 'JJ'), ('media', 'NNS'), ('.', '.')]";movement make skeptic . woman make alleg , guy 's career ruin alway guilti proven innoc trial social media .;movement make skeptical . woman make allegation , guy 's career ruin always guilty proven innocent trial social medium .
59514;twitter;1/14/18 7:39;TRUE;;RT @bride720: Dear #MeToo I support you 100% but could you please stop calling people sexual predators without the other side of the story…;en;MeToo;;Colorado via Missouri;;;;3/5/09 6:41;Shashana80sKid;Shashana 🇺🇸;#ProudAfricanAmerican #ADOS #Xennial #Feminist & #Progressive. Love #Politics #SamCooke & #MyAncestors. @UOfDenver alum. #NeverBernie #BlackNewDeal;40166;False;3199;600;5;0;;63;False;False;True;english;rt @bride720: dear #metoo i support you 100% but could you please stop calling people sexual predators without the other side of the story…;  dear  i suppo you 100% but could you please stop calling people sexual predators without the other side of the story…;dear suppo 100 % could please stop calling people sexual predators without side story… ;[('dear', 'JJ'), ('suppo', 'RB'), ('100', 'CD'), ('%', 'NN'), ('could', 'MD'), ('please', 'VB'), ('stop', 'VB'), ('calling', 'VBG'), ('people', 'NNS'), ('sexual', 'JJ'), ('predators', 'NNS'), ('without', 'IN'), ('side', 'NN'), ('story…', 'NN')];dear suppo 100 % could pleas stop call peopl sexual predat without side story…;dear suppo 100 % could please stop call people sexual predator without side story…
59515;twitter;1/14/18 7:37;TRUE;;"RT @NyanaKakoma: Attention African writers...

#MeToo https://t.co/7olrnlNlYg";en;MeToo;;those ends!;;;;5/11/09 10:42;niwaroll;Roland Byagaba;Check out @muwado a social network I run. #JoinMuwado #SosoNetworking @badiditech #ManChild #Rolex #Badidity;8771;False;1329;965;75;0;https://t.co/6aVRRaA6mc;8;False;False;False;english;"rt @nyanakakoma: attention african writers...

#metoo https://t.co/7olrnlnlyg";"  attention african writers...

 ";attention african writers ... ;[('attention', 'NN'), ('african', 'JJ'), ('writers', 'NNS'), ('...', ':')];attent african writer ...;attention african writer ...
59516;twitter;1/14/18 7:37;TRUE;;RT @333szn: Every actor in Hollywood right now #metoo https://t.co/pFUmPmMRx2;en;metoo;;;;;;12/28/14 21:35;DameronBrandon;🔥DakGoatScott🔥;;8777;False;195;257;1;0;;6;True;False;True;english;rt @333szn: every actor in hollywood right now #metoo https://t.co/pfumpmmrx2;  every actor in hollywood right now  ;every actor hollywood right ;[('every', 'DT'), ('actor', 'NN'), ('hollywood', 'NN'), ('right', 'NN')];everi actor hollywood right;every actor hollywood right
59517;twitter;1/14/18 7:37;TRUE;;"RT @k80way: I talked to a girl who says she went on a date with @azizansari in an exclusive for @babedotnet. She told me, ""It was by far th…";en;;azizansari,babedotnet;Olympia, WA;;;;6/24/12 3:09;lilphungy;lynny!!;a fashion hoe n a house bitch 💋;40146;False;1580;842;7821;0;https://t.co/ayWQl950fN;28;False;False;True;english;"rt @k80way: i talked to a girl who says she went on a date with @azizansari in an exclusive for @babedotnet. she told me, ""it was by far th…";"  i talked to a girl who says she went on a date with  in an exclusive for  she told me, ""it was by far th…";talked girl says went date exclusive told , `` far th… ;[('talked', 'VBN'), ('girl', 'NN'), ('says', 'VBZ'), ('went', 'VBD'), ('date', 'NN'), ('exclusive', 'JJ'), ('told', 'NN'), (',', ','), ('``', '``'), ('far', 'RB'), ('th…', 'JJ')];talk girl say went date exclus told , `` far th…;talk girl say go date exclusive told ,  far th…
59518;twitter;1/14/18 7:37;TRUE;;"RT @k80way: I talked to a girl who says she went on a date with @azizansari in an exclusive for @babedotnet. She told me, ""It was by far th…";en;;azizansari,babedotnet;;;;;1/8/11 4:35;tyrellwellthic;amber;rami malek owns my ass;65978;False;3101;3090;7821;0;;63;False;False;True;english;"rt @k80way: i talked to a girl who says she went on a date with @azizansari in an exclusive for @babedotnet. she told me, ""it was by far th…";"  i talked to a girl who says she went on a date with  in an exclusive for  she told me, ""it was by far th…";talked girl says went date exclusive told , `` far th… ;[('talked', 'VBN'), ('girl', 'NN'), ('says', 'VBZ'), ('went', 'VBD'), ('date', 'NN'), ('exclusive', 'JJ'), ('told', 'NN'), (',', ','), ('``', '``'), ('far', 'RB'), ('th…', 'JJ')];talk girl say went date exclus told , `` far th…;talk girl say go date exclusive told ,  far th…
59519;twitter;1/14/18 7:38;TRUE;;RT @bairdjulia: It is wrong to call the #metoo movement a witch hunt. The whole point of witch trials in history is that THERE IS NO SUCH T…;en;metoo;;Maryland, USA;;;;6/18/09 8:22;MKFan90;MKFan;#JusticeForAugust;10005;False;313;797;401;0;;3;False;False;True;english;rt @bairdjulia: it is wrong to call the #metoo movement a witch hunt. the whole point of witch trials in history is that there is no such t…;  it is wrong to call the  movement a witch hunt. the whole point of witch trials in history is that there is no such t…;wrong call movement witch hunt . whole point witch trials history t… ;[('wrong', 'JJ'), ('call', 'JJ'), ('movement', 'NN'), ('witch', 'NN'), ('hunt', 'NN'), ('.', '.'), ('whole', 'JJ'), ('point', 'NN'), ('witch', 'NN'), ('trials', 'NNS'), ('history', 'NN'), ('t…', 'NN')];wrong call movement witch hunt . whole point witch trial histori t…;wrong call movement witch hunt . whole point witch trial history t…
59520;twitter;1/14/18 7:38;TRUE;;RT @drboycewatkins1: Odd that the #metoo campaign won’t defend Ginuwine’s right to refuse an uninvited sexual advance.   You can’t have it…;en;metoo;;California Knows How To Party;;;;11/26/15 3:09;AmazonLoni;we got him. 🤝;why you tripping? I ain’t even doin nothin.;241548;False;6761;642;142;0;;393;False;False;True;english;rt @drboycewatkins1: odd that the #metoo campaign won’t defend ginuwine’s right to refuse an uninvited sexual advance.   you can’t have it…;  odd that the  campaign won’t defend ginuwine’s right to refuse an uninvited sexual advance.   you can’t have it…;odd campaign ’ defend ginuwine ’ right refuse uninvited sexual advance . ’ it… ;[('odd', 'JJ'), ('campaign', 'NN'), ('’', 'NNP'), ('defend', 'VBP'), ('ginuwine', 'NN'), ('’', 'NN'), ('right', 'RB'), ('refuse', 'RB'), ('uninvited', 'JJ'), ('sexual', 'JJ'), ('advance', 'NN'), ('.', '.'), ('’', 'CD'), ('it…', 'NN')];odd campaign ’ defend ginuwin ’ right refus uninvit sexual advanc . ’ it…;odd campaign ’ defend ginuwine ’ right refuse uninvited sexual advance . ’ it…
59522;twitter;1/14/18 7:38;TRUE;;"RT @k80way: I talked to a girl who says she went on a date with @azizansari in an exclusive for @babedotnet. She told me, ""It was by far th…";en;;azizansari,babedotnet; Brazil;;;;4/3/13 15:08;D_Fitzpatrick8;Daymien;Bill Clinton just wanted sum top in the oval office he ain’t do shit;19488;False;732;69;7821;0;https://t.co/jhG9nc6cSt;6;False;False;True;english;"rt @k80way: i talked to a girl who says she went on a date with @azizansari in an exclusive for @babedotnet. she told me, ""it was by far th…";"  i talked to a girl who says she went on a date with  in an exclusive for  she told me, ""it was by far th…";talked girl says went date exclusive told , `` far th… ;[('talked', 'VBN'), ('girl', 'NN'), ('says', 'VBZ'), ('went', 'VBD'), ('date', 'NN'), ('exclusive', 'JJ'), ('told', 'NN'), (',', ','), ('``', '``'), ('far', 'RB'), ('th…', 'JJ')];talk girl say went date exclus told , `` far th…;talk girl say go date exclusive told ,  far th…
59523;twitter;1/14/18 7:38;FALSE;@Ohflattery @The_Jank @melbathecat @eveewing If you want people to understand your position then you can start by not offending them for something they didn't choose to be. Plus this conversation isn't a waste of time. The metoo movement isn't going anywhere. We can have many conversations.;;en;;Ohflattery,The_Jank,melbathecat,eveewing;Earth;;;;5/15/15 0:54;COTSS1;Victor Terrae;Libertarian Socialist. Coming to take your guns with the help of black helicopters.;25914;False;167;193;0;0;https://t.co/dDNKkbsCs4;2;False;False;False;english;@ohflattery @the_jank @melbathecat @eveewing if you want people to understand your position then you can start by not offending them for something they didn't choose to be. plus this conversation is not a waste of time. the metoo movement is not going anywhere. we can have many conversations.;    if you want people to understand your position then you can sta by not offending them for something they didn't choose to be. plus this conversation is not a waste of time. the metoo movement is not going anywhere. we can have many conversations.;want people understand position sta offending something n't choose . plus conversation waste time . metoo movement going anywhere . many conversations . ;"[('want', 'JJ'), ('people', 'NNS'), ('understand', 'VBP'), ('position', 'NN'), ('sta', 'NN'), ('offending', 'VBG'), ('something', 'NN'), (""n't"", 'RB'), ('choose', 'VB'), ('.', '.'), ('plus', 'CC'), ('conversation', 'JJ'), ('waste', 'NN'), ('time', 'NN'), ('.', '.'), ('metoo', 'VB'), ('movement', 'NN'), ('going', 'VBG'), ('anywhere', 'RB'), ('.', '.'), ('many', 'JJ'), ('conversations', 'NNS'), ('.', '.')]";want peopl understand posit sta offend someth n't choos . plu convers wast time . metoo movement go anywher . mani convers .;want people understand position sta offend something n't choose . plus conversation waste time . metoo movement go anywhere . many conversation .
59524;twitter;1/14/18 7:38;FALSE;And like every respectable movement, the #MeToo has become a damn witchhunt. This is frustrating, and I feel bad for victims of abuse and assault who won't be heard as a result.;;en;MeToo;;United States;;;;1/26/11 17:46;LSUnited91;LSUnited;If it looks good, eat it.;24835;False;145;485;0;0;;3;False;False;False;english;and like every respectable movement, the #metoo has become a damn witchhunt. this is frustrating, and i feel bad for victims of abuse and assault who will not be heard as a result.;and like every respectable movement, the  has become a damn witchhunt. this is frustrating, and i feel bad for victims of abuse and assault who will not be heard as a result.;like every respectable movement , become damn witchhunt . frustrating , feel bad victims abuse assault heard result . ;[('like', 'IN'), ('every', 'DT'), ('respectable', 'JJ'), ('movement', 'NN'), (',', ','), ('become', 'VB'), ('damn', 'JJ'), ('witchhunt', 'NN'), ('.', '.'), ('frustrating', 'NN'), (',', ','), ('feel', 'VB'), ('bad', 'JJ'), ('victims', 'NNS'), ('abuse', 'IN'), ('assault', 'NN'), ('heard', 'VBN'), ('result', 'NN'), ('.', '.')];like everi respect movement , becom damn witchhunt . frustrat , feel bad victim abus assault heard result .;like every respectable movement , become damn witchhunt . frustrating , feel bad victim abuse assault hear result .
59525;twitter;1/14/18 7:38;TRUE;;"RT @k80way: I talked to a girl who says she went on a date with @azizansari in an exclusive for @babedotnet. She told me, ""It was by far th…";en;;azizansari,babedotnet;New Jersey, USA;;;;8/20/14 4:51;gabriela_elahay;Gabie ™;20|RU  Insta: @gabrielaabarquez;2305;False;242;252;7821;0;;1;False;False;True;english;"rt @k80way: i talked to a girl who says she went on a date with @azizansari in an exclusive for @babedotnet. she told me, ""it was by far th…";"  i talked to a girl who says she went on a date with  in an exclusive for  she told me, ""it was by far th…";talked girl says went date exclusive told , `` far th… ;[('talked', 'VBN'), ('girl', 'NN'), ('says', 'VBZ'), ('went', 'VBD'), ('date', 'NN'), ('exclusive', 'JJ'), ('told', 'NN'), (',', ','), ('``', '``'), ('far', 'RB'), ('th…', 'JJ')];talk girl say went date exclus told , `` far th…;talk girl say go date exclusive told ,  far th…
59526;twitter;1/14/18 7:38;TRUE;;RT @SaysHummingbird: As my friend @funder rightly points out, Congress MUST establish a #TrumpSexProbe to investigate the 20 sexual assault…;en;TrumpSexProbe;funder;San Francisco, CA;;;;1/28/16 21:50;WhyDontYouCare4;BarbOHellNo;Petra Luna, musician activist. Trump Vs Women & Survivors? Let's battle bitch!!! #BelieveSurvivors #MeToo #Impeach45 #ProtectMueller #NeverAgain #Basta;23406;False;729;1380;1717;0;https://t.co/zrYsf7HKZt;25;False;False;True;english;rt @sayshummingbird: as my friend @funder rightly points out, congress must establish a #trumpsexprobe to investigate the 20 sexual assault…;  as my friend  rightly points out, congress must establish a  to investigate the 20 sexual assault…;friend rightly points , congress must establish investigate 20 sexual assault… ;[('friend', 'NN'), ('rightly', 'RB'), ('points', 'NNS'), (',', ','), ('congress', 'NN'), ('must', 'MD'), ('establish', 'VB'), ('investigate', 'VB'), ('20', 'CD'), ('sexual', 'JJ'), ('assault…', 'NN')];friend rightli point , congress must establish investig 20 sexual assault…;friend rightly point , congress must establish investigate 20 sexual assault…
59527;twitter;1/14/18 7:38;TRUE;;"RT @k80way: I talked to a girl who says she went on a date with @azizansari in an exclusive for @babedotnet. She told me, ""It was by far th…";en;;azizansari,babedotnet;Behind you! ;;;;4/25/09 2:23;ashtonrocksgod;Ashton Baker;She/her, serpent slut, dgaf.;3565;False;136;224;7821;0;;2;False;False;False;english;"rt @k80way: i talked to a girl who says she went on a date with @azizansari in an exclusive for @babedotnet. she told me, ""it was by far th…";"  i talked to a girl who says she went on a date with  in an exclusive for  she told me, ""it was by far th…";talked girl says went date exclusive told , `` far th… ;[('talked', 'VBN'), ('girl', 'NN'), ('says', 'VBZ'), ('went', 'VBD'), ('date', 'NN'), ('exclusive', 'JJ'), ('told', 'NN'), (',', ','), ('``', '``'), ('far', 'RB'), ('th…', 'JJ')];talk girl say went date exclus told , `` far th…;talk girl say go date exclusive told ,  far th…
59529;twitter;1/14/18 7:37;FALSE;"Can everyone just cut the rhetoric that Aziz Ansari is in the same bracket as Weinstein, Spacey et al? 

All nuance appears to have disappeared from discourse for the “all men are pigs #metoo “ approach.";;en;metoo;;Westminster;;;;6/9/17 7:31;SivilCervice;Sivil Cervice;Politically neutral. Disdain equally distributed.;49;False;0;29;0;1;;0;True;False;False;english;"can everyone just cut the rhetoric that aziz ansari is in the same bracket as weinstein, spacey et al? 

all nuance appears to have disappeared from discourse for the “all men are pigs #metoo “ approach.";"can everyone just cut the rhetoric that aziz ansari is in the same bracket as weinstein, spacey et al? 

all nuance appears to have disappeared from discourse for the “all men are pigs  “ approach.";everyone cut rhetoric aziz ansari bracket weinstein , spacey et al ? nuance appears disappeared discourse “ men pigs “ approach . ;[('everyone', 'NN'), ('cut', 'NN'), ('rhetoric', 'NN'), ('aziz', 'NN'), ('ansari', 'NN'), ('bracket', 'NN'), ('weinstein', 'NN'), (',', ','), ('spacey', 'JJ'), ('et', 'FW'), ('al', 'NN'), ('?', '.'), ('nuance', 'NN'), ('appears', 'VBZ'), ('disappeared', 'JJ'), ('discourse', 'NN'), ('“', 'NNP'), ('men', 'NNS'), ('pigs', 'VBP'), ('“', 'JJ'), ('approach', 'NN'), ('.', '.')];everyon cut rhetor aziz ansari bracket weinstein , spacey et al ? nuanc appear disappear discours “ men pig “ approach .;everyone cut rhetoric aziz ansari bracket weinstein , spacey et al ? nuance appear disappeared discourse  men pig  approach .
59530;twitter;1/14/18 7:37;TRUE;;"RT @AylanX: Imagine a world where social justice ""limits what you can contribute to society"" - as I write this one day before Martin Luther…";en;;;;;;;3/16/10 0:14;deejayndn;Migizi Bebaayaad;Nbiising Anishnabe Baabaa. Diniim. Mishome. Sayenh. Gwiss. @NSB_Speakers. MMPR. Instagram and Twitch: @deejayndn @wearedetectives;46115;False;16920;4900;25;0;https://t.co/jUBAjlokyy;276;False;False;False;english;"rt @aylanx: imagine a world where social justice ""limits what you can contribute to society"" - as i write this one day before martin luther…";"  imagine a world where social justice ""limits what you can contribute to society"" - as i write this one day before main luther…";imagine world social justice `` limits contribute society '' - write one day main luther… ;[('imagine', 'JJ'), ('world', 'NN'), ('social', 'JJ'), ('justice', 'NN'), ('``', '``'), ('limits', 'NNS'), ('contribute', 'VBP'), ('society', 'NN'), ('``', '``'), ('-', ':'), ('write', 'VB'), ('one', 'CD'), ('day', 'NN'), ('main', 'JJ'), ('luther…', 'NN')];imagin world social justic `` limit contribut societi `` - write one day main luther…;imagine world social justice  limit contribute society  - write one day main luther…
59531;twitter;1/14/18 7:37;FALSE;BBC News - France's celebrity pushback against 'MeToo' https://t.co/dWkmWbNpC9 a good article that is helping to start to frame a decent debate on the topic in my opinion.;;en;;;London and France;;;;1/5/09 14:42;codfather;codfather #FBPE;Technologist, Atheist, rationalist, empiricist and non believer in unicorns, virgin births or Brexit.Friend of Linux, Science, Wine and the Arts;20017;False;8898;9765;0;0;https://t.co/7yu3CUHuB0;103;False;False;False;english;bbc news - france's celebrity pushback against 'metoo' https://t.co/dwkmwbnpc9 a good article that is helping to start to frame a decent debate on the topic in my opinion.;bbc news - france's celebrity pushback against 'metoo'  a good aicle that is helping to sta to frame a decent debate on the topic in my opinion.;bbc news - france 's celebrity pushback 'metoo ' good aicle helping sta frame decent debate topic opinion . ;"[('bbc', 'NN'), ('news', 'NN'), ('-', ':'), ('france', 'NN'), (""'s"", 'POS'), ('celebrity', 'NN'), ('pushback', 'NN'), (""'metoo"", 'NNP'), (""'"", 'POS'), ('good', 'JJ'), ('aicle', 'NN'), ('helping', 'VBG'), ('sta', 'JJ'), ('frame', 'JJ'), ('decent', 'JJ'), ('debate', 'NN'), ('topic', 'NN'), ('opinion', 'NN'), ('.', '.')]";bbc news - franc 's celebr pushback 'metoo ' good aicl help sta frame decent debat topic opinion .;bbc news - france 's celebrity pushback 'metoo ' good aicle help sta frame decent debate topic opinion .
59532;twitter;1/14/18 7:37;TRUE;;"RT @k80way: I talked to a girl who says she went on a date with @azizansari in an exclusive for @babedotnet. She told me, ""It was by far th…";en;;azizansari,babedotnet;Hong Kong;;;;4/25/09 4:45;ididwy;不然你要我怎麼樣®;'You deserve the ignorance and bliss that I still wish I had' (El-P, 2007);146075;False;1413;692;7821;0;https://t.co/hjMecc1TKf;80;False;False;False;english;"rt @k80way: i talked to a girl who says she went on a date with @azizansari in an exclusive for @babedotnet. she told me, ""it was by far th…";"  i talked to a girl who says she went on a date with  in an exclusive for  she told me, ""it was by far th…";talked girl says went date exclusive told , `` far th… ;[('talked', 'VBN'), ('girl', 'NN'), ('says', 'VBZ'), ('went', 'VBD'), ('date', 'NN'), ('exclusive', 'JJ'), ('told', 'NN'), (',', ','), ('``', '``'), ('far', 'RB'), ('th…', 'JJ')];talk girl say went date exclus told , `` far th…;talk girl say go date exclusive told ,  far th…
59533;twitter;1/14/18 7:37;TRUE;;"RT @k80way: I talked to a girl who says she went on a date with @azizansari in an exclusive for @babedotnet. She told me, ""It was by far th…";en;;azizansari,babedotnet;Měnagwĕs (Saint John);;;;9/5/16 18:45;fallonhewitt_;Fallon Hewitt;reporter @TJProvincial | @humberjournos alum | past: @chathamnews + @sarniaobserver | tips to hewitt.fallon@brunswicknews.com;6801;False;640;962;7821;0;https://t.co/C6jklkpscW;17;False;False;True;english;"rt @k80way: i talked to a girl who says she went on a date with @azizansari in an exclusive for @babedotnet. she told me, ""it was by far th…";"  i talked to a girl who says she went on a date with  in an exclusive for  she told me, ""it was by far th…";talked girl says went date exclusive told , `` far th… ;[('talked', 'VBN'), ('girl', 'NN'), ('says', 'VBZ'), ('went', 'VBD'), ('date', 'NN'), ('exclusive', 'JJ'), ('told', 'NN'), (',', ','), ('``', '``'), ('far', 'RB'), ('th…', 'JJ')];talk girl say went date exclus told , `` far th…;talk girl say go date exclusive told ,  far th…
59534;twitter;1/14/18 7:37;TRUE;;"RT @funder: Can we please

For the love of God

Talk about the 20 women

That Trump has raped, sexually assaulted, groped, inappropriately…";en;;;;;;;7/7/11 3:55;MediumRichie;OtherwiseBlamelessGenius;;6129;False;95;896;7201;0;;0;True;False;False;english;"rt @funder: can we please

for the love of god

talk about the 20 women

that trump has raped, sexually assaulted, groped, inappropriately…";"  can we please

for the love of god

talk about the 20 women

that trump has raped, sexually assaulted, groped, inappropriately…";please love god talk 20 women trump raped , sexually assaulted , groped , inappropriately… ;[('please', 'VB'), ('love', 'VB'), ('god', 'NN'), ('talk', 'NN'), ('20', 'CD'), ('women', 'NNS'), ('trump', 'NN'), ('raped', 'VBD'), (',', ','), ('sexually', 'RB'), ('assaulted', 'VBN'), (',', ','), ('groped', 'VBD'), (',', ','), ('inappropriately…', 'NN')];pleas love god talk 20 women trump rape , sexual assault , grope , inappropriately…;please love god talk 20 woman trump rap , sexually assault , grope , inappropriately…
59535;twitter;1/14/18 7:37;TRUE;;RT @CHSommers: This baseless attack on Aziz Ansari trivializes the #Metoo movement. #WitchHunt https://t.co/Z5EUhCUEZJ;en;Metoo, WitchHunt;;Chez Leanne;;;;9/13/13 0:20;LSJorari;Leanne Jorari;🌺 La vie est belle 🌺;2519;False;734;203;671;0;https://t.co/5fCmXUQ5WQ;17;False;False;False;english;rt @chsommers: this baseless attack on aziz ansari trivializes the #metoo movement. #witchhunt https://t.co/z5euhcuezj;  this baseless attack on aziz ansari trivializes the  movement.  ;baseless attack aziz ansari trivializes movement . ;[('baseless', 'JJ'), ('attack', 'NN'), ('aziz', 'NN'), ('ansari', 'NN'), ('trivializes', 'VBZ'), ('movement', 'NN'), ('.', '.')];baseless attack aziz ansari trivial movement .;baseless attack aziz ansari trivialize movement .
59536;twitter;1/14/18 7:37;TRUE;;"RT @k80way: I talked to a girl who says she went on a date with @azizansari in an exclusive for @babedotnet. She told me, ""It was by far th…";en;;azizansari,babedotnet;;;;;5/27/11 21:22;JSpruel10;glo;go outside;362518;False;158;121;7821;0;https://t.co/UQzmZk0Dqh;13;False;False;False;english;"rt @k80way: i talked to a girl who says she went on a date with @azizansari in an exclusive for @babedotnet. she told me, ""it was by far th…";"  i talked to a girl who says she went on a date with  in an exclusive for  she told me, ""it was by far th…";talked girl says went date exclusive told , `` far th… ;[('talked', 'VBN'), ('girl', 'NN'), ('says', 'VBZ'), ('went', 'VBD'), ('date', 'NN'), ('exclusive', 'JJ'), ('told', 'NN'), (',', ','), ('``', '``'), ('far', 'RB'), ('th…', 'JJ')];talk girl say went date exclus told , `` far th…;talk girl say go date exclusive told ,  far th…
59537;twitter;1/14/18 7:36;FALSE;Condi Rice Worries That #MeToo Movement Could Turn Women Into ‘Snowflakes’ https://t.co/XjUz0N7IVD via @dailycaller;;en;MeToo;DailyCaller;Porto, Portugal;;;;2/2/14 22:18;joaquimsacouto;Joaquim Couto;Pause & Play / Comprem o meu livro A PEREGRINA (PT) e serão perdoados de todos os maus pensamentos :-) https://t.co/IPkCwRdsuD;32125;False;862;526;0;0;https://t.co/cFVWaOQO1B;13;False;False;False;english;condi rice worries that #metoo movement could turn women into ‘snowflakes’ https://t.co/xjuz0n7ivd via @dailycaller;condi rice worries that  movement could turn women into ‘snowflakes’  via ;condi rice worries movement could turn women ‘ snowflakes ’ via ;[('condi', 'NN'), ('rice', 'NN'), ('worries', 'NNS'), ('movement', 'NN'), ('could', 'MD'), ('turn', 'VB'), ('women', 'NNS'), ('‘', 'NNP'), ('snowflakes', 'NNS'), ('’', 'VBP'), ('via', 'IN')];condi rice worri movement could turn women ‘ snowflak ’ via;condi rice worry movement could turn woman ‘ snowflake ’ via
