id;source;created_date;is_retweet;text;text_retweet;language;hashtags;mentions;location;geo_location;geo_country;geo_coordinates;user_created_at;screen_name;name;profile_description;total_number_of_tweets;is_verified;followers_count;friends_count;retweets_count;favorite_count;url;listed_count;default_profile;default_profile_image;has_extended_profile;language_desc;tweet_full;pre_proc_tweet;stop_filter_tweet;pos_tags;stem_filter;lemma_filter
26000;twitter;1/26/18 16:51;FALSE;First animal accused of sexual harrasment by femnazi's of hollywood 🤣 #femnazi #MeToo https://t.co/1EVZasT03N;;en;femnazi, MeToo;;PA;;;;4/17/09 20:07;solitaryecho10;Kayleigh Quinzel;I’m tough, I’m ambitious, and I know exactly what I want. If that makes me a bitch, okay.;1897;False;148;255;0;0;https://t.co/4YgRNijc90;4;False;False;False;english;first animal accused of sexual harrasment by femnazi's of hollywood 🤣 #femnazi #metoo https://t.co/1evzast03n;first animal accused of sexual harrasment by femnazi's of hollywood 🤣   ;first animal accused sexual harrasment femnazi 's hollywood 🤣 ;"[('first', 'RB'), ('animal', 'NN'), ('accused', 'VBN'), ('sexual', 'JJ'), ('harrasment', 'NN'), ('femnazi', 'NN'), (""'s"", 'POS'), ('hollywood', 'NN'), ('🤣', 'NN')]";first anim accus sexual harras femnazi 's hollywood 🤣;first animal accuse sexual harrasment femnazi 's hollywood 🤣
26001;twitter;1/26/18 16:51;FALSE;Harvard Law School professor Elizabeth Bartholet argued recently that the #MeToo movement… https://t.co/gvTQt1XBtH;;en;MeToo;;Ya tu sabes #tdot #toronto #bluejays #tfc  ;;;;5/23/10 18:45;TheJ3di;.;Any law enforcement or anyone affiliated with law enforcement is not allowed to follow or view any tweets or pictures in this account or use any info here.;39021;False;468;817;0;0;https://t.co/N5aqu0fUF3;40;False;False;False;english;harvard law school professor elizabeth bartholet argued recently that the #metoo movement… https://t.co/gvtqt1xbth;harvard law school professor elizabeth baholet argued recently that the  movement… ;harvard law school professor elizabeth baholet argued recently movement… ;[('harvard', 'NN'), ('law', 'NN'), ('school', 'NN'), ('professor', 'NN'), ('elizabeth', 'VBP'), ('baholet', 'NN'), ('argued', 'VBD'), ('recently', 'RB'), ('movement…', 'VBN')];harvard law school professor elizabeth baholet argu recent movement…;harvard law school professor elizabeth baholet argue recently movement…
26002;twitter;1/26/18 16:51;TRUE;;"RT @RepLeanne: Thanks, @PennLive, for inviting me to talk about my #MeToo bill &amp; what it's like to serve as a woman in a Legislature that's…";en;MeToo;PennLive;Pennsylvania;;;;4/17/09 15:46;PaHouseDems;PA House Democrats;News and information from the Pennsylvania House Democratic Caucus;29765;True;22922;4453;8;0;http://t.co/8me0hV3rvf;475;False;False;False;english;"rt @repleanne: thanks, @pennlive, for inviting me to talk about my #metoo bill &amp; what it is like to serve as a woman in a legislature that's…";"  thanks,  for inviting me to talk about my  bill &amp; what it is like to serve as a woman in a legislature that's…";"thanks , inviting talk bill & amp ; like serve woman legislature that's… ";"[('thanks', 'NNS'), (',', ','), ('inviting', 'VBG'), ('talk', 'NN'), ('bill', 'NN'), ('&', 'CC'), ('amp', 'NN'), (';', ':'), ('like', 'IN'), ('serve', 'VBP'), ('woman', 'NN'), ('legislature', 'NN'), (""that's…"", 'NN')]";"thank , invit talk bill & amp ; like serv woman legislatur that's…";"thanks , invite talk bill & amp ; like serve woman legislature that's…"
26003;twitter;1/26/18 16:51;FALSE;"@GraceandFrankie mid-episode 12 and NOT happy. Why is this season all about how the women need care. Last season Robert had a heart attack and no one suggested he be put in a home! G&amp;F clearly are feeble as compared to Robt &amp; Sol. #metoo";;en;metoo;GraceandFrankie;;;;;9/3/14 16:42;retiringart;Marguerite;;5962;False;135;345;0;0;;6;False;False;True;english;"@graceandfrankie mid-episode 12 and not happy. why is this season all about how the women need care. last season robert had a heart attack and no one suggested he be put in a home! g&amp;f clearly are feeble as compared to robt &amp; sol. #metoo";" mid-episode 12 and not happy. why is this season all about how the women need care. last season robe had a hea attack and no one suggested he be put in a home! g&amp;f clearly are feeble as compared to robt &amp; sol. ";"mid-episode 12 happy . season women need care . last season robe hea attack one suggested put home ! g & amp ; f clearly feeble compared robt & amp ; sol . ";"[('mid-episode', 'JJ'), ('12', 'CD'), ('happy', 'JJ'), ('.', '.'), ('season', 'NN'), ('women', 'NNS'), ('need', 'VBP'), ('care', 'NN'), ('.', '.'), ('last', 'JJ'), ('season', 'NN'), ('robe', 'NN'), ('hea', 'VBD'), ('attack', 'RP'), ('one', 'CD'), ('suggested', 'VBN'), ('put', 'VBD'), ('home', 'NN'), ('!', '.'), ('g', 'NN'), ('&', 'CC'), ('amp', 'NN'), (';', ':'), ('f', 'CC'), ('clearly', 'RB'), ('feeble', 'JJ'), ('compared', 'VBN'), ('robt', 'NN'), ('&', 'CC'), ('amp', 'NN'), (';', ':'), ('sol', 'NN'), ('.', '.')]";"mid-episod 12 happi . season women need care . last season robe hea attack one suggest put home ! g & amp ; f clearli feebl compar robt & amp ; sol .";"mid-episode 12 happy . season woman need care . last season robe hea attack one suggest put home ! g & amp ; f clearly feeble compare robt & amp ; sol ."
26004;twitter;1/26/18 16:51;FALSE;Let's cut the shit. If @UweBollRaw stepped into the cage with Lowtax, Uwe would be taken down so quick and Rich would make him the latest member of the #MeToo movement. @richard_kyanka #DirectThat;;en;MeToo, DirectThat;UweBollRaw,richard_kyanka;City Of Failure;;;;1/22/18 21:29;HandsomeDickM;Handsome Dick Masterson;America's Wingman, Writer, American Zeitgeist, dedicated homme vivant. Host of The Dick Show. Parody.;157;False;1041;29;0;1;https://t.co/Fi3qYlgbXX;0;True;False;False;english;let's cut the shit. if @uwebollraw stepped into the cage with lowtax, uwe would be taken down so quick and rich would make him the latest member of the #metoo movement. @richard_kyanka #directthat;let's cut the shit. if  stepped into the cage with lowtax, uwe would be taken down so quick and rich would make him the latest member of the  movement.  ;let 's cut shit . stepped cage lowtax , uwe would taken quick rich would make latest member movement . ;"[('let', 'NN'), (""'s"", 'POS'), ('cut', 'NN'), ('shit', 'NN'), ('.', '.'), ('stepped', 'VBD'), ('cage', 'NN'), ('lowtax', 'NN'), (',', ','), ('uwe', 'NN'), ('would', 'MD'), ('taken', 'VBN'), ('quick', 'JJ'), ('rich', 'NN'), ('would', 'MD'), ('make', 'VB'), ('latest', 'JJS'), ('member', 'NN'), ('movement', 'NN'), ('.', '.')]";let 's cut shit . step cage lowtax , uwe would taken quick rich would make latest member movement .;let 's cut shit . step cage lowtax , uwe would take quick rich would make late member movement .
26005;twitter;1/26/18 16:51;TRUE;;RT @stereogum: Grammys' #MeToo moment will see @KeshaRose performing with @Camila_Cabello, @cyndilauper, @imjmichaels, and @AndraDayMusic h…;en;MeToo;KeshaRose,Camila_Cabello,cyndilauper,imjmichaels,AndraDayMusic;;;;;7/10/15 21:41;BabyCamila19;Alex Consequences🌙;#CAMILA 🦋🌹✨// Camilizer// All my love for the incredible human @Camila_Cabello;12451;False;229;268;326;0;;1;False;False;True;english;rt @stereogum: grammys' #metoo moment will see @kesharose performing with @camila_cabello, @cyndilauper, @imjmichaels, and @andradaymusic h…;  grammys'  moment will see  performing with    and  h…;grammys ' moment see performing h… ;"[('grammys', 'NN'), (""'"", ""''""), ('moment', 'NN'), ('see', 'VBP'), ('performing', 'VBG'), ('h…', 'NN')]";grammi ' moment see perform h…;grammys ' moment see perform h…
26007;twitter;1/26/18 16:51;TRUE;;"RT @funder: RT if you agree there should be a #TrumpSexProbe.

In 2017 @SpeakerRyan &amp; his GOP Congress ignored &amp; refused to investigate 20…";en;TrumpSexProbe;SpeakerRyan;;;;;9/17/15 20:46;capers_mec3;MEC;;1398;False;27;0;1940;0;;0;True;True;False;english;"rt @funder: rt if you agree there should be a #trumpsexprobe.

in 2017 @speakerryan &amp; his gop congress ignored &amp; refused to investigate 20…";"   if you agree there should be a rumpsexprobe.

in 2017  &amp; his gop congress ignored &amp; refused to investigate 20…";"agree rumpsexprobe . 2017 & amp ; gop congress ignored & amp ; refused investigate 20… ";"[('agree', 'JJ'), ('rumpsexprobe', 'NN'), ('.', '.'), ('2017', 'CD'), ('&', 'CC'), ('amp', 'NN'), (';', ':'), ('gop', 'CC'), ('congress', 'NN'), ('ignored', 'VBD'), ('&', 'CC'), ('amp', 'NN'), (';', ':'), ('refused', 'VBD'), ('investigate', 'VB'), ('20…', 'CD')]";"agre rumpsexprob . 2017 & amp ; gop congress ignor & amp ; refus investig 20…";"agree rumpsexprobe . 2017 & amp ; gop congress ignore & amp ; refuse investigate 20…"
26008;twitter;1/26/18 16:51;FALSE;If you’re a guy having trouble figuring out if she’s giving consent, here’s what worked for me: Listen for her to say “I do”. #MeToo;;en;MeToo;;Seattle;;;;10/4/10 15:20;porrvision;Peter Orr;Graphic designer, puppet enthusiast, organism.;853;False;100;147;0;0;https://t.co/ukixFCTMeu;4;False;False;False;english;if you’re a guy having trouble figuring out if she’s giving consent, here’s what worked for me: listen for her to say “i do”. #metoo;if you’re a guy having trouble figuring out if she’s giving consent, here’s what worked for me: listen for her to say “i do”. ;’ guy trouble figuring ’ giving consent , ’ worked : listen say “ ” . ;[('’', 'JJ'), ('guy', 'NN'), ('trouble', 'NN'), ('figuring', 'VBG'), ('’', 'JJ'), ('giving', 'VBG'), ('consent', 'NN'), (',', ','), ('’', 'JJ'), ('worked', 'VBD'), (':', ':'), ('listen', 'NNS'), ('say', 'VBP'), ('“', 'JJ'), ('”', 'NN'), ('.', '.')];’ guy troubl figur ’ give consent , ’ work : listen say “ ” .;’ guy trouble figure ’ give consent , ’ work : listen say   .
26009;twitter;1/26/18 16:51;TRUE;;RT @doctor_oxford: If @realDonaldTrump didn’t like the booing at Davos, just wait until he hears the British people in full voice 🇬🇧🏳️‍🌈💕✊…;en;;realDonaldTrump;;;;;5/8/14 9:31;robdarneyno1;Rob Darney;;24189;False;156;540;243;0;;0;True;False;True;english;rt @doctor_oxford: if @realdonaldtrump didn’t like the booing at davos, just wait until he hears the british people in full voice 🇬🇧🏳️‍🌈💕✊…;  if  didn’t like the booing at davos, just wait until he hears the british people in full voice 🇬🇧🏳️‍🌈💕✊…;’ like booing davos , wait hears british people full voice 🇬🇧🏳️‍🌈💕✊… ;[('’', 'NNS'), ('like', 'IN'), ('booing', 'VBG'), ('davos', 'NN'), (',', ','), ('wait', 'VBP'), ('hears', 'NNS'), ('british', 'JJ'), ('people', 'NNS'), ('full', 'JJ'), ('voice', 'NN'), ('🇬🇧🏳️\u200d🌈💕✊…', 'NN')];’ like boo davo , wait hear british peopl full voic 🇬🇧🏳️‍🌈💕✊…;’ like boo davos , wait hears british people full voice 🇬🇧🏳️‍🌈💕✊…
26010;twitter;1/26/18 16:48;TRUE;;RT @DeniseDresserG: Leer: la diferencia legal entre mala conducta sexual, acoso, y violación. Urge esclarecer y tipificar penalmente esos c…;es;;;CDMX, México;;;;3/21/10 23:40;jessicaggoma;Jess;No soporto la injusticia y el doble discurso. No digas estar con el pueblo cuando tus decisiones sólo benefician a tu sector.;31536;False;1229;1470;122;0;;14;False;False;False;spanish;rt @denisedresserg: leer: la diferencia legal entre mala conducta sexual, acoso, y violación. urge esclarecer y tipificar penalmente esos c…;  leer: la diferencia legal entre mala conducta sexual, acoso, y violación. urge esclarecer y tipificar penalmente esos c…;leer : diferencia legal mala conducta sexual , acoso , violación . urge esclarecer tipificar penalmente c… ;[('leer', 'NN'), (':', ':'), ('diferencia', 'JJ'), ('legal', 'JJ'), ('mala', 'NN'), ('conducta', 'NN'), ('sexual', 'JJ'), (',', ','), ('acoso', 'JJ'), (',', ','), ('violación', 'NN'), ('.', '.'), ('urge', 'JJ'), ('esclarecer', 'NN'), ('tipificar', 'NN'), ('penalmente', 'NN'), ('c…', 'NN')];leer : diferencia legal mala conducta sexual , acoso , violación . urg esclarec tipificar penalment c…;leer : diferencia legal mala conducta sexual , acoso , violación . urge esclarecer tipificar penalmente c…
26011;twitter;1/26/18 16:49;FALSE;@halsey I hope you unlike me, you can identify and get the justices on your abuser. #EnoughIsEnough #NoMeansNo #metoo #TimesUp #sexualharassment #YourMistakedoesNOTdefineME;;en;EnoughIsEnough, NoMeansNo, metoo, TimesUp, sexualharassment, YourMistakedoesNOTdefineME;halsey;;;;;2/7/16 0:48;mindovermidwest;Shayla Hurt;Midwest blogger of https://t.co/pzNgBluowu;430;False;125;1220;0;0;;2;True;False;False;english;@halsey i hope you unlike me, you can identify and get the justices on your abuser. #enoughisenough #nomeansno #metoo #timesup #sexualharassment #yourmistakedoesnotdefineme; i hope you unlike me, you can identify and get the justices on your abuser.      ;hope unlike , identify get justices abuser . ;[('hope', 'NN'), ('unlike', 'IN'), (',', ','), ('identify', 'VB'), ('get', 'VB'), ('justices', 'NNS'), ('abuser', 'RB'), ('.', '.')];hope unlik , identifi get justic abus .;hope unlike , identify get justice abuser .
26012;twitter;1/26/18 16:49;TRUE;;RT @ETCanada: .@KeshaRose to perrform with @Camila_Cabello @cyndilauper @imjmichaels and @AndraDayMusic in #MeToo moment at the #GRAMMYs ht…;en;MeToo, GRAMMYs;KeshaRose,Camila_Cabello,cyndilauper,imjmichaels,AndraDayMusic;;;;;4/21/13 5:15;afterslow;cr;;103419;False;6239;5226;404;0;;155;False;False;True;english;rt @etcanada: .@kesharose to perrform with @camila_cabello @cyndilauper @imjmichaels and @andradaymusic in #metoo moment at the #grammys ht…;  . to perrform with    and  in  moment at the  ht…;. perrform moment ht… ;[('.', '.'), ('perrform', 'VB'), ('moment', 'NN'), ('ht…', 'NN')];. perrform moment ht…;. perrform moment ht…
26013;twitter;1/26/18 16:49;FALSE;"“If you have more power, remember to listen as much as you talk. And if you have less power remember, to talk as much as you listen"".  Gloria Steinem's message to women and girls: Act like a cat https://t.co/bsyMCwyuRc via @qz";;en;;qz;Toronto, Ontario;;;;8/27/09 13:28;DocHeatherD;Dr. Heather Drummond;Counsellor-Faculty-Passionate Advocate for Student Success * Spreading Psychology Through Technology #EDTech #EQ #PsychNerd #eSuccessCoaching;820;False;675;597;0;1;https://t.co/ZjyF3jEqJg;13;False;False;False;english;"“if you have more power, remember to listen as much as you talk. and if you have less power remember, to talk as much as you listen"".  gloria steinem's message to women and girls: act like a cat https://t.co/bsymcwyurc via @qz";"“if you have more power, remember to listen as much as you talk. and if you have less power remember, to talk as much as you listen"".  gloria steinem's message to women and girls: act like a cat  via ";“ power , remember listen much talk . less power remember , talk much listen '' . gloria steinem 's message women girls : act like cat via ;"[('“', 'JJ'), ('power', 'NN'), (',', ','), ('remember', 'VB'), ('listen', 'RB'), ('much', 'JJ'), ('talk', 'NN'), ('.', '.'), ('less', 'JJR'), ('power', 'NN'), ('remember', 'NN'), (',', ','), ('talk', 'NN'), ('much', 'RB'), ('listen', 'VBZ'), ('``', '``'), ('.', '.'), ('gloria', 'NN'), ('steinem', 'NN'), (""'s"", 'POS'), ('message', 'NN'), ('women', 'NNS'), ('girls', 'NNS'), (':', ':'), ('act', 'NN'), ('like', 'IN'), ('cat', 'NN'), ('via', 'IN')]";“ power , rememb listen much talk . less power rememb , talk much listen `` . gloria steinem 's messag women girl : act like cat via; power , remember listen much talk . less power remember , talk much listen  . gloria steinem 's message woman girl : act like cat via
26014;twitter;1/26/18 16:49;TRUE;;"RT @funder: RT if you agree there should be a #TrumpSexProbe.

In 2017 @SpeakerRyan &amp; his GOP Congress ignored &amp; refused to investigate 20…";en;TrumpSexProbe;SpeakerRyan;United States;;;;12/19/11 5:10;deedemari;🎶 Dorinda 📖;Avid book reader, podcast lover, political news junkie, intererested in way to many things to list!;2840;False;99;547;1940;0;;0;False;False;False;english;"rt @funder: rt if you agree there should be a #trumpsexprobe.

in 2017 @speakerryan &amp; his gop congress ignored &amp; refused to investigate 20…";"   if you agree there should be a rumpsexprobe.

in 2017  &amp; his gop congress ignored &amp; refused to investigate 20…";"agree rumpsexprobe . 2017 & amp ; gop congress ignored & amp ; refused investigate 20… ";"[('agree', 'JJ'), ('rumpsexprobe', 'NN'), ('.', '.'), ('2017', 'CD'), ('&', 'CC'), ('amp', 'NN'), (';', ':'), ('gop', 'CC'), ('congress', 'NN'), ('ignored', 'VBD'), ('&', 'CC'), ('amp', 'NN'), (';', ':'), ('refused', 'VBD'), ('investigate', 'VB'), ('20…', 'CD')]";"agre rumpsexprob . 2017 & amp ; gop congress ignor & amp ; refus investig 20…";"agree rumpsexprobe . 2017 & amp ; gop congress ignore & amp ; refuse investigate 20…"
26015;twitter;1/26/18 16:49;TRUE;;"RT @funder: RT if you agree there should be a #TrumpSexProbe.

In 2017 @SpeakerRyan &amp; his GOP Congress ignored &amp; refused to investigate 20…";en;TrumpSexProbe;SpeakerRyan;GONZO LAND, USA;;;;11/1/17 15:48;doctor_emerick;Doctor Emerick;Politics - Baseball - Music - Cornfields and Cracker Jacks;3150;False;121;238;1940;0;;0;False;False;False;english;"rt @funder: rt if you agree there should be a #trumpsexprobe.

in 2017 @speakerryan &amp; his gop congress ignored &amp; refused to investigate 20…";"   if you agree there should be a rumpsexprobe.

in 2017  &amp; his gop congress ignored &amp; refused to investigate 20…";"agree rumpsexprobe . 2017 & amp ; gop congress ignored & amp ; refused investigate 20… ";"[('agree', 'JJ'), ('rumpsexprobe', 'NN'), ('.', '.'), ('2017', 'CD'), ('&', 'CC'), ('amp', 'NN'), (';', ':'), ('gop', 'CC'), ('congress', 'NN'), ('ignored', 'VBD'), ('&', 'CC'), ('amp', 'NN'), (';', ':'), ('refused', 'VBD'), ('investigate', 'VB'), ('20…', 'CD')]";"agre rumpsexprob . 2017 & amp ; gop congress ignor & amp ; refus investig 20…";"agree rumpsexprobe . 2017 & amp ; gop congress ignore & amp ; refuse investigate 20…"
26016;twitter;1/26/18 16:49;FALSE;Top story: Casey Affleck Won’t Present the Oscar for Best Actress https://t.co/IyVOzvyOPH, see more https://t.co/kORpkSdq0Z;;en;;;;;;;3/18/13 3:08;marcantoineandr;Marc-Antoine André;;7517;False;16;52;0;0;;2;True;False;False;english;top story: casey affleck won’t present the oscar for best actress https://t.co/iyvozvyoph, see more https://t.co/korpksdq0z;top story: casey affleck won’t present the oscar for best actress  see more ;top story : casey affleck ’ present oscar best actress see ;[('top', 'JJ'), ('story', 'NN'), (':', ':'), ('casey', 'NN'), ('affleck', 'NN'), ('’', 'NNP'), ('present', 'JJ'), ('oscar', 'NN'), ('best', 'JJS'), ('actress', 'NN'), ('see', 'NN')];top stori : casey affleck ’ present oscar best actress see;top story : casey affleck ’ present oscar best actress see
26017;twitter;1/26/18 16:49;TRUE;;"RT @kazweida: Larry Nassar was sentenced to 175 years in prison.
He abused over 168 girls during the course of his career in gymnastics.

L…";en;;;Finland;;;;8/10/12 20:32;Janinalap;Janina;a real life angel :);54550;False;320;320;365;0;;48;False;False;True;english;"rt @kazweida: larry nassar was sentenced to 175 years in prison.
he abused over 168 girls during the course of his career in gymnastics.

l…";"  larry nassar was sentenced to 175 years in prison.
he abused over 168 girls during the course of his career in gymnastics.

l…";larry nassar sentenced 175 years prison . abused 168 girls course career gymnastics . l… ;[('larry', 'NN'), ('nassar', 'RB'), ('sentenced', 'VBD'), ('175', 'CD'), ('years', 'NNS'), ('prison', 'NN'), ('.', '.'), ('abused', 'VBD'), ('168', 'CD'), ('girls', 'NNS'), ('course', 'NN'), ('career', 'NN'), ('gymnastics', 'NNS'), ('.', '.'), ('l…', 'NN')];larri nassar sentenc 175 year prison . abus 168 girl cours career gymnast . l…;larry nassar sentence 175 year prison . abuse 168 girl course career gymnastics . l…
26018;twitter;1/26/18 16:49;FALSE;Casey Affleck renuncia a presentar el Oscar a la mejor actriz ante la presión del movimiento #MeToo https://t.co/ETTLS2XZIG;;es;MeToo;;;;;;11/5/09 20:28;disparamargot;Dispara Margot;De lunes a viernes, 10:00 a 12:00 del día por MVS Radio.;19589;False;123336;1539;8;32;http://t.co/gTqOkbxzp4;369;False;False;False;spanish;casey affleck renuncia a presentar el oscar a la mejor actriz ante la presión del movimiento #metoo https://t.co/ettls2xzig;casey affleck renuncia a presentar el oscar a la mejor actriz ante la presión del movimiento  ;casey affleck renuncia presentar oscar mejor actriz presión movimiento ;[('casey', 'NN'), ('affleck', 'NN'), ('renuncia', 'NN'), ('presentar', 'NN'), ('oscar', 'NN'), ('mejor', 'NN'), ('actriz', 'NN'), ('presión', 'NN'), ('movimiento', 'NN')];casey affleck renuncia presentar oscar mejor actriz presión movimiento;casey affleck renuncia presentar oscar mejor actriz presión movimiento
26019;twitter;1/26/18 16:49;TRUE;;"RT @funder: .@SpeakerRyan-You’ve done nothing but hurt the #MeToo &amp; #TimesUp movements. You helped cover up the fact Trump sexually assault…";en;MeToo, TimesUp;SpeakerRyan;Ohio, USA;;;;11/12/16 4:36;Susanweav;Susan weaver;Nurse, mom, wife, sister, daughter, Democrat, resister;2018;False;62;118;899;0;;0;True;False;True;english;"rt @funder: .@speakerryan-you’ve done nothing but hurt the #metoo &amp; #timesup movements. you helped cover up the fact trump sexually assault…";"  . done nothing but hu the  &amp;  movements. you helped cover up the fact trump sexually assault…";". done nothing hu & amp ; movements . helped cover fact trump sexually assault… ";"[('.', '.'), ('done', 'VBN'), ('nothing', 'NN'), ('hu', 'NN'), ('&', 'CC'), ('amp', 'NN'), (';', ':'), ('movements', 'NNS'), ('.', '.'), ('helped', 'VBD'), ('cover', 'VB'), ('fact', 'NN'), ('trump', 'IN'), ('sexually', 'RB'), ('assault…', 'JJ')]";". done noth hu & amp ; movement . help cover fact trump sexual assault…";". do nothing hu & amp ; movement . help cover fact trump sexually assault…"
26020;twitter;1/26/18 16:49;TRUE;;"RT @funder: RT if you agree there should be a #TrumpSexProbe.

In 2017 @SpeakerRyan &amp; his GOP Congress ignored &amp; refused to investigate 20…";en;TrumpSexProbe;SpeakerRyan;Southern California;;;;3/28/14 8:36;KoAbba;Abbazabba;;13324;False;309;834;1940;0;;0;False;False;False;english;"rt @funder: rt if you agree there should be a #trumpsexprobe.

in 2017 @speakerryan &amp; his gop congress ignored &amp; refused to investigate 20…";"   if you agree there should be a rumpsexprobe.

in 2017  &amp; his gop congress ignored &amp; refused to investigate 20…";"agree rumpsexprobe . 2017 & amp ; gop congress ignored & amp ; refused investigate 20… ";"[('agree', 'JJ'), ('rumpsexprobe', 'NN'), ('.', '.'), ('2017', 'CD'), ('&', 'CC'), ('amp', 'NN'), (';', ':'), ('gop', 'CC'), ('congress', 'NN'), ('ignored', 'VBD'), ('&', 'CC'), ('amp', 'NN'), (';', ':'), ('refused', 'VBD'), ('investigate', 'VB'), ('20…', 'CD')]";"agre rumpsexprob . 2017 & amp ; gop congress ignor & amp ; refus investig 20…";"agree rumpsexprobe . 2017 & amp ; gop congress ignore & amp ; refuse investigate 20…"
26021;twitter;1/26/18 16:49;TRUE;;"RT @fanniesroom: You know #metoo hasn't gone near far enough when ""that lady judge should've been nicer to that guy who assaulted more than…";en;metoo;;;;;;1/18/15 2:57;_jadenlundy;✨jay✨;Trent U | 21;7119;False;299;479;8616;0;;2;False;False;True;english;"rt @fanniesroom: you know #metoo hasn't gone near far enough when ""that lady judge should've been nicer to that guy who assaulted more than…";"  you know  hasn't gone near far enough when ""that lady judge should've been nicer to that guy who assaulted more than…";know n't gone near far enough `` lady judge 've nicer guy assaulted than… ;"[('know', 'VBP'), (""n't"", 'RB'), ('gone', 'VBN'), ('near', 'RB'), ('far', 'RB'), ('enough', 'JJ'), ('``', '``'), ('lady', 'JJ'), ('judge', 'NN'), (""'ve"", 'VBP'), ('nicer', 'VBN'), ('guy', 'NN'), ('assaulted', 'VBN'), ('than…', 'NN')]";know n't gone near far enough `` ladi judg 've nicer guy assault than…;know n't go near far enough  lady judge 've nicer guy assault than…
26022;twitter;1/26/18 16:49;FALSE;@LOLGOP So glad to see that they are so influenced by the #metoo movement.;;en;metoo;LOLGOP;New Jersey;;;;2/6/17 23:42;Just_Nag_Em;Megan Lynn;Jersey Girl Straight Out of a Bruce Springsteen Song | Law Student | Equal Opportunity Door Holder | Post-term Fetus | Rock. Flag. Eagle.;9055;False;181;1164;0;1;;1;False;False;False;english;@lolgop so glad to see that they are so influenced by the #metoo movement.; so glad to see that they are so influenced by the  movement.;glad see influenced movement . ;[('glad', 'JJ'), ('see', 'NN'), ('influenced', 'JJ'), ('movement', 'NN'), ('.', '.')];glad see influenc movement .;glad see influenced movement .
