id;source;created_date;is_retweet;text;text_retweet;language;hashtags;mentions;location;geo_location;geo_country;geo_coordinates;user_created_at;screen_name;name;profile_description;total_number_of_tweets;is_verified;followers_count;friends_count;retweets_count;favorite_count;url;listed_count;default_profile;default_profile_image;has_extended_profile;language_desc;tweet_full;pre_proc_tweet;stop_filter_tweet;pos_tags;stem_filter;lemma_filter
87237;twitter;1/5/18 17:44;TRUE;;RT @lasoncini: we seem to be returning to a victimology paradigm for young women, in particular, in which they are perceived to be — and pe…;en;;;;;;;7/15/10 11:29;LauryeMal;Laura;Patience is a virtue for those who have time to waste. ***Disclaimer***: No fucks were given during the production of this account. Sono qui solo per le GIF.;129081;False;1538;1286;5;0;;93;False;False;True;english;rt @lasoncini: we seem to be returning to a victimology paradigm for young women, in particular, in which they are perceived to be — and pe…;  we seem to be returning to a victimology paradigm for young women, in paicular, in which they are perceived to be — and pe…;seem returning victimology paradigm young women , paicular , perceived — pe… ;[('seem', 'VB'), ('returning', 'VBG'), ('victimology', 'NN'), ('paradigm', 'NN'), ('young', 'JJ'), ('women', 'NNS'), (',', ','), ('paicular', 'JJ'), (',', ','), ('perceived', 'VBD'), ('—', 'JJ'), ('pe…', 'NN')];seem return victimolog paradigm young women , paicular , perceiv — pe…;seem return victimology paradigm young woman , paicular , perceive — pe…
87238;twitter;1/5/18 17:44;TRUE;;RT @DaShanneStokes: Just a reminder: Trump, who is a proud and admitted sexual predator, is still being sued for violating the Constitution…;en;;;New York, USA;;;;7/2/15 20:33;varanone;The Defenestrator;Rage tweeting for a better world. #resist #protectMueller #ImpeachTrump #GOPcorruption;8695;False;909;3396;35;0;;4;False;False;False;english;rt @dashannestokes: just a reminder: trump, who is a proud and admitted sexual predator, is still being sued for violating the constitution…;  just a reminder: trump, who is a proud and admitted sexual predator, is still being sued for violating the constitution…;reminder : trump , proud admitted sexual predator , still sued violating constitution… ;[('reminder', 'NN'), (':', ':'), ('trump', 'NN'), (',', ','), ('proud', 'NN'), ('admitted', 'VBD'), ('sexual', 'JJ'), ('predator', 'NN'), (',', ','), ('still', 'RB'), ('sued', 'VBN'), ('violating', 'VBG'), ('constitution…', 'NN')];remind : trump , proud admit sexual predat , still su violat constitution…;reminder : trump , proud admit sexual predator , still sue violate constitution…
87239;twitter;1/5/18 17:44;FALSE;I enjoyed this read and am looking forward to the movie. The study of people in difficult but real situations... https://t.co/V9EDkmsPb6;;en;;;Cincinnati & Dayton;;;;11/7/08 19:07;Richmomm;Misty M. Richmond;teacher, researcher, idea addict;5079;False;131;224;0;0;https://t.co/evJthFygzE;5;False;False;True;english;i enjoyed this read and am looking forward to the movie. the study of people in difficult but real situations... https://t.co/v9edkmspb6;i enjoyed this read and am looking forward to the movie. the study of people in difficult but real situations... ;enjoyed read looking forward movie . study people difficult real situations ... ;[('enjoyed', 'VBN'), ('read', 'VBP'), ('looking', 'VBG'), ('forward', 'RB'), ('movie', 'NN'), ('.', '.'), ('study', 'NN'), ('people', 'NNS'), ('difficult', 'JJ'), ('real', 'JJ'), ('situations', 'NNS'), ('...', ':')];enjoy read look forward movi . studi peopl difficult real situat ...;enjoy read look forward movie . study people difficult real situation ...
87240;twitter;1/5/18 17:42;FALSE;Terri Clark - Girls Lie Too https://t.co/sLjyN9Fqxg via @YouTube #metoo;;en;metoo;YouTube;Hallsberg, Sverige;;;;3/24/13 7:44;RogerSoting;Roger Soting;Byggsmed och  svetsare på AE:s plåt i Örebro. Moppe entusiast och Mcåkare.;4339;False;163;474;0;0;;1;True;False;False;english;terri clark - girls lie too https://t.co/sljyn9fqxg via @youtube #metoo;terri clark - girls lie too  via  ;terri clark - girls lie via ;[('terri', 'NN'), ('clark', 'NN'), ('-', ':'), ('girls', 'NNS'), ('lie', 'VBP'), ('via', 'IN')];terri clark - girl lie via;terri clark - girl lie via
87241;twitter;1/5/18 17:43;TRUE;;RT @NSVRC: It does NOT matter what a victim was wearing, how they were acting, if they were drinking, or what type of relationship they had…;en;;;fl / UNF / insta: jadehelenaa;;;;11/28/14 23:27;vanilIaabean;jade ♡;just a 19 year old bean-sized girl. made of one part bean, two parts cannoli.;6804;False;248;204;41;0;;2;True;False;True;english;rt @nsvrc: it does not matter what a victim was wearing, how they were acting, if they were drinking, or what type of relationship they had…;  it does not matter what a victim was wearing, how they were acting, if they were drinking, or what type of relationship they had…;matter victim wearing , acting , drinking , type relationship had… ;[('matter', 'NN'), ('victim', 'NN'), ('wearing', 'NN'), (',', ','), ('acting', 'NN'), (',', ','), ('drinking', 'NN'), (',', ','), ('type', 'NN'), ('relationship', 'NN'), ('had…', 'NN')];matter victim wear , act , drink , type relationship had…;matter victim wearing , acting , drinking , type relationship had…
87242;twitter;1/5/18 17:43;FALSE;Publicly, We Say #MeToo. Privately, We Have Misgivings. https://t.co/YFDfJOHjtS;;en;MeToo;;Purcellville, VA (USA);;;;10/17/09 12:20;Rob_Bennett_;Rob Bennett;Buy-&-Hold caused the economic crisis by teaching investors not to sell even when prices reach insanely high levels. I urge Valuation-Informed Indexing.;12698;False;947;317;0;0;http://t.co/yts1vnomjt;67;False;False;False;english;publicly, we say #metoo. privately, we have misgivings. https://t.co/yfdfjohjts;publicly, we say  privately, we have misgivings. ;publicly , say privately , misgivings . ;[('publicly', 'RB'), (',', ','), ('say', 'VBP'), ('privately', 'RB'), (',', ','), ('misgivings', 'NNS'), ('.', '.')];publicli , say privat , misgiv .;publicly , say privately , misgiving .
87243;twitter;1/5/18 17:43;FALSE;To people who are just accusing pretty much anything of diminishing or destroying the #metoo movement, I ask, how weak are your morals exactly? How fragile is your sense of awareness?;;en;metoo;;New York;;;;6/17/11 10:46;Dreama_Land;Dreama;Re-living the years I wasn’t alive;2050;False;184;450;0;0;;1;False;False;False;english;to people who are just accusing pretty much anything of diminishing or destroying the #metoo movement, i ask, how weak are your morals exactly? how fragile is your sense of awareness?;to people who are just accusing pretty much anything of diminishing or destroying the  movement, i ask, how weak are your morals exactly? how fragile is your sense of awareness?;people accusing pretty much anything diminishing destroying movement , ask , weak morals exactly ? fragile sense awareness ? ;[('people', 'NNS'), ('accusing', 'VBG'), ('pretty', 'RB'), ('much', 'JJ'), ('anything', 'NN'), ('diminishing', 'VBG'), ('destroying', 'VBG'), ('movement', 'NN'), (',', ','), ('ask', 'NN'), (',', ','), ('weak', 'JJ'), ('morals', 'NNS'), ('exactly', 'RB'), ('?', '.'), ('fragile', 'JJ'), ('sense', 'NN'), ('awareness', 'NN'), ('?', '.')];peopl accus pretti much anyth diminish destroy movement , ask , weak moral exactli ? fragil sens awar ?;people accuse pretty much anything diminish destroy movement , ask , weak moral exactly ? fragile sense awareness ?
87244;twitter;1/5/18 17:43;TRUE;;"RT @sarahjeong: “There’s only so much cheerleading we can do,” my scientist friend said. “We’re drowning in cheerleading.” 

https://t.co/Y…";en;;;Australia;;;;2/17/10 0:56;MsLods;Leanne O'Donnell;Law, tech & human rights. | Lapsed lawyer. | Tweeting in a personal capacity. |;71341;False;6365;641;16;0;;451;False;False;False;english;"rt @sarahjeong: “there’s only so much cheerleading we can do,” my scientist friend said. “we’re drowning in cheerleading.” 

https://t.co/y…";"  “there’s only so much cheerleading we can do,” my scientist friend said. “we’re drowning in cheerleading.” 

";“ ’ much cheerleading , ” scientist friend said . “ ’ drowning cheerleading . ” ;[('“', 'VB'), ('’', 'RB'), ('much', 'JJ'), ('cheerleading', 'NN'), (',', ','), ('”', 'JJ'), ('scientist', 'NN'), ('friend', 'NN'), ('said', 'VBD'), ('.', '.'), ('“', 'JJ'), ('’', 'JJ'), ('drowning', 'VBG'), ('cheerleading', 'NN'), ('.', '.'), ('”', 'NN')];“ ’ much cheerlead , ” scientist friend said . “ ’ drown cheerlead . ”; ’ much cheerleading ,  scientist friend say .  ’ drown cheerleading . 
87245;twitter;1/5/18 17:43;FALSE;Ayooooooo IG wild right now 😂😂😂😂😂😂😂😂😂😂😂 #MeToo;;en;MeToo;;Shark city ;;;;3/24/11 2:20;Steps_757;The Wzrd;IG-steps757 . snapchat - jsteps757 . EnjoyandMaintain™ operations Director https://t.co/S4uqmszjN1;201938;False;2228;1590;0;0;https://t.co/rPikLgTOko;17;False;False;False;english;ayooooooo ig wild right now 😂😂😂😂😂😂😂😂😂😂😂 #metoo;ayooooooo ig wild right now 😂😂😂😂😂😂😂😂😂😂😂 ;ayooooooo ig wild right 😂😂😂😂😂😂😂😂😂😂😂 ;[('ayooooooo', 'NN'), ('ig', 'NN'), ('wild', 'JJ'), ('right', 'JJ'), ('😂😂😂😂😂😂😂😂😂😂😂', 'NN')];ayooooooo ig wild right 😂😂😂😂😂😂😂😂😂😂😂;ayooooooo ig wild right 😂😂😂😂😂😂😂😂😂😂😂
87246;twitter;1/5/18 17:42;FALSE;Because men get fat too. #MeToo https://t.co/abqRoM7Jur;;en;MeToo;;Philadelphia;;;;2/25/14 18:11;specialisted2;Specialist Ed;A politically incorrect observer of the human condition and all around badass. Offending the easily offended since 2014.;2535;False;272;580;0;1;http://t.co/6EBaMhlr2q;3;True;False;False;english;because men get fat too. #metoo https://t.co/abqrom7jur;because men get fat too.  ;men get fat . ;[('men', 'NNS'), ('get', 'VBP'), ('fat', 'JJ'), ('.', '.')];men get fat .;men get fat .
87247;twitter;1/5/18 17:42;TRUE;;RT @BizCommission: We share with @ImpactAlpha their hope that every #MeToo story is matched by examples of capital backing women-led and wo…;en;MeToo;ImpactAlpha;San Francisco, CA;;;;1/27/13 19:45;impactspace;ImpactSpace;ImpactSpace the open data platform powering the global impact investing marketplace. Join us now!;2285;False;3798;1292;6;0;http://t.co/nXkGgPMxgV;182;True;False;False;english;rt @bizcommission: we share with @impactalpha their hope that every #metoo story is matched by examples of capital backing women-led and wo…;  we share with  their hope that every  story is matched by examples of capital backing women-led and wo…;share hope every story matched examples capital backing women-led wo… ;[('share', 'NN'), ('hope', 'NN'), ('every', 'DT'), ('story', 'NN'), ('matched', 'VBN'), ('examples', 'NNS'), ('capital', 'NN'), ('backing', 'VBG'), ('women-led', 'JJ'), ('wo…', 'NN')];share hope everi stori match exampl capit back women-l wo…;share hope every story match example capital back women-led wo…
87248;twitter;1/5/18 17:42;TRUE;;RT @funder: .@SpeakerRyan-Everyone who retweets this wants you to open up an investigation into the 20 sexual assault claims against Donald…;en;;SpeakerRyan;Alaska, USA;;;;5/23/13 4:46;CPD_AK;Alyeska Cat ❄️🇺🇸🍎🌊🧡🗽⚖️;Decent human being. Used to think 45 was only crazy, now know he is also evil and threatens our very existence. #Alaska #Resist #GunSenseVoter #HealthcareVoter;49619;False;309;927;37677;0;https://t.co/QP7znOIU4T;4;True;False;False;english;rt @funder: .@speakerryan-everyone who retweets this wants you to open up an investigation into the 20 sexual assault claims against donald…;  . who retweets this wants you to open up an investigation into the 20 sexual assault claims against donald…;. retweets wants open investigation 20 sexual assault claims donald… ;[('.', '.'), ('retweets', 'NNS'), ('wants', 'VBZ'), ('open', 'JJ'), ('investigation', 'NN'), ('20', 'CD'), ('sexual', 'JJ'), ('assault', 'NN'), ('claims', 'NNS'), ('donald…', 'VBP')];. retweet want open investig 20 sexual assault claim donald…;. retweets want open investigation 20 sexual assault claim donald…
87249;twitter;1/5/18 17:42;TRUE;;RT @TomArnold: Sean I’m still pissed you sat on lame Leeann Tweeden-Al Franken USO pic for 10 yrs b4 Roger Stone told you Al was askin 2 ma…;en;;;;;;;6/5/17 16:06;DianHeymann;Diana Heymann Adu (M;;7139;False;108;577;1187;0;;0;True;True;False;english;rt @tomarnold: sean i’m still pissed you sat on lame leeann tweeden-al franken uso pic for 10 yrs b4 roger stone told you al was askin 2 ma…;  sean i’m still pissed you sat on lame leeann tweeden-al franken uso pic for 10 yrs b4 roger stone told you al was askin 2 ma…;sean ’ still pissed sat lame leeann tweeden-al franken uso pic 10 yrs b4 roger stone told al askin 2 ma… ;[('sean', 'JJ'), ('’', 'NNP'), ('still', 'RB'), ('pissed', 'VBD'), ('sat', 'JJ'), ('lame', 'JJ'), ('leeann', 'JJ'), ('tweeden-al', 'JJ'), ('franken', 'NN'), ('uso', 'JJ'), ('pic', 'NN'), ('10', 'CD'), ('yrs', 'NN'), ('b4', 'NN'), ('roger', 'NN'), ('stone', 'NN'), ('told', 'VBD'), ('al', 'JJ'), ('askin', 'JJ'), ('2', 'CD'), ('ma…', 'NN')];sean ’ still piss sat lame leeann tweeden- franken uso pic 10 yr b4 roger stone told al askin 2 ma…;sean ’ still piss sat lame leeann tweeden-al franken uso pic 10 yr b4 roger stone tell al askin 2 ma…
87250;twitter;1/5/18 17:42;TRUE;;RT @ditzkoff: I wrote about @sethmeyers as he prepares to host a @goldenglobes show for the #MeToo moment and celebrate an entertainment in…;en;MeToo;sethmeyers,goldenglobes;;;;;8/25/10 23:49;riclud;Rick Ludwin;Have loved TV since I was a kid. NBC exec who said yes to SEINFELD, worked in late night w/ J Carson, SNL, Letterman, Conan Fallon Seth Meyers, Carson D. Lucky!;3026;False;1297;20;116;0;;29;True;False;False;english;rt @ditzkoff: i wrote about @sethmeyers as he prepares to host a @goldenglobes show for the #metoo moment and celebrate an entertainment in…;  i wrote about  as he prepares to host a  show for the  moment and celebrate an enteainment in…;wrote prepares host show moment celebrate enteainment in… ;[('wrote', 'VBD'), ('prepares', 'NNS'), ('host', 'VB'), ('show', 'VB'), ('moment', 'NN'), ('celebrate', 'NN'), ('enteainment', 'NN'), ('in…', 'NN')];wrote prepar host show moment celebr enteain in…;write prepares host show moment celebrate enteainment in…
87251;twitter;1/5/18 17:42;FALSE;On Rankine's comment: the kinds of behaviors that haven't been called out for so long will not be tolerated in future, evidenced by #MeToo, so the asshole creating a hostile environment must evolve if s/he wants to continue escaping being brought to account #session12 #aiascs;;en;MeToo, session12, aiascs;;Worcester, MA;;;;4/6/17 19:04;DLibatique10;Daniel Libatique 🏳️‍🌈;Lecturer @CHC_Classics. Ph.D. from @BUClassics. | Ovid, Greek drama, narratology, gender, DH. He/him. 🐍. @ovid_bot | @ta_ergaleia. Oxford comma enthusiast.;4388;False;1133;374;0;3;https://t.co/sUEiOAZ61Y;17;False;False;True;english;on rankine's comment: the kinds of behaviors that have not been called out for so long will not be tolerated in future, evidenced by #metoo, so the asshole creating a hostile environment must evolve if s/he wants to continue escaping being brought to account #session12 #aiascs;on rankine's comment: the kinds of behaviors that have not been called out for so long will not be tolerated in future, evidenced by  so the asshole creating a hostile environment must evolve if s/he wants to continue escaping being brought to account  ;rankine 's comment : kinds behaviors called long tolerated future , evidenced asshole creating hostile environment must evolve s/he wants continue escaping brought account ;"[('rankine', 'NN'), (""'s"", 'POS'), ('comment', 'NN'), (':', ':'), ('kinds', 'NNS'), ('behaviors', 'NNS'), ('called', 'VBD'), ('long', 'RB'), ('tolerated', 'JJ'), ('future', 'NN'), (',', ','), ('evidenced', 'VBD'), ('asshole', 'JJ'), ('creating', 'VBG'), ('hostile', 'JJ'), ('environment', 'NN'), ('must', 'MD'), ('evolve', 'VB'), ('s/he', 'NN'), ('wants', 'VBZ'), ('continue', 'VBP'), ('escaping', 'VBG'), ('brought', 'VBD'), ('account', 'NN')]";rankin 's comment : kind behavior call long toler futur , evidenc asshol creat hostil environ must evolv s/he want continu escap brought account;rankine 's comment : kind behavior call long tolerated future , evidence asshole create hostile environment must evolve s/he want continue escape bring account
87253;twitter;1/5/18 17:42;TRUE;;RT @DaShanneStokes: Just a reminder: Trump, who is a proud and admitted sexual predator, is still being sued for violating the Constitution…;en;;;New York, USA;;;;3/5/16 5:41;fuckyoutrumpp;INDICTtheMOTHERFUCKER!🌊;🙃#impeachTrump United we Stand! #TheResistance #OneHumanFamily;27321;False;2338;4982;35;0;;14;True;False;True;english;rt @dashannestokes: just a reminder: trump, who is a proud and admitted sexual predator, is still being sued for violating the constitution…;  just a reminder: trump, who is a proud and admitted sexual predator, is still being sued for violating the constitution…;reminder : trump , proud admitted sexual predator , still sued violating constitution… ;[('reminder', 'NN'), (':', ':'), ('trump', 'NN'), (',', ','), ('proud', 'NN'), ('admitted', 'VBD'), ('sexual', 'JJ'), ('predator', 'NN'), (',', ','), ('still', 'RB'), ('sued', 'VBN'), ('violating', 'VBG'), ('constitution…', 'NN')];remind : trump , proud admit sexual predat , still su violat constitution…;reminder : trump , proud admit sexual predator , still sue violate constitution…
87254;twitter;1/5/18 17:38;FALSE;Daphne Merkin's article makes perfect sense coming from a trust fund brat who's written multiple think pieces on the complexities of growing up rich 🙄 https://t.co/PU7P8qGnlG;;en;;;Brooklyn, NY;;;;7/1/15 18:01;QueerCurmudgeon;Queer Curmudgeon;Aspiring to be the nerdy librarian of your dreams/nightmares.;2801;False;624;719;0;2;;3;False;False;False;english;daphne merkin's article makes perfect sense coming from a trust fund brat who's written multiple think pieces on the complexities of growing up rich 🙄 https://t.co/pu7p8qgnlg;daphne merkin's aicle makes perfect sense coming from a trust fund brat who's written multiple think pieces on the complexities of growing up rich 🙄 ;daphne merkin 's aicle makes perfect sense coming trust fund brat 's written multiple think pieces complexities growing rich 🙄 ;"[('daphne', 'NN'), ('merkin', 'NN'), (""'s"", 'POS'), ('aicle', 'NN'), ('makes', 'VBZ'), ('perfect', 'JJ'), ('sense', 'NN'), ('coming', 'VBG'), ('trust', 'NN'), ('fund', 'NN'), ('brat', 'NN'), (""'s"", 'POS'), ('written', 'VBN'), ('multiple', 'JJ'), ('think', 'NN'), ('pieces', 'NNS'), ('complexities', 'NNS'), ('growing', 'VBG'), ('rich', 'JJ'), ('🙄', 'NN')]";daphn merkin 's aicl make perfect sens come trust fund brat 's written multipl think piec complex grow rich 🙄;daphne merkin 's aicle make perfect sense come trust fund brat 's write multiple think piece complexity grow rich 🙄
87255;twitter;1/5/18 17:38;TRUE;;RT @TimRunsHisMouth: Meryl Streep calls out Melania and Ivanka Trump on Silence during the #MeToo movement... got it. https://t.co/3NFIs4q9…;en;MeToo;;;;;;11/11/12 12:45;Sbrown5225;Suzanne Brown;;4037;False;74;167;1247;0;;9;True;False;False;english;rt @timrunshismouth: meryl streep calls out melania and ivanka trump on silence during the #metoo movement... got it. https://t.co/3nfis4q9…;  meryl streep calls out melania and ivanka trump on silence during the  movement... got it. ;meryl streep calls melania ivanka trump silence movement ... got . ;[('meryl', 'JJ'), ('streep', 'NN'), ('calls', 'VBZ'), ('melania', 'JJ'), ('ivanka', 'NN'), ('trump', 'NN'), ('silence', 'NN'), ('movement', 'NN'), ('...', ':'), ('got', 'VBD'), ('.', '.')];meryl streep call melania ivanka trump silenc movement ... got .;meryl streep call melania ivanka trump silence movement ... get .
87256;twitter;1/5/18 17:38;TRUE;;"RT @HollywoodInToto: Proud to be contributing to The Washington Times once more!

#GoldenGlobes telecast to feature Harvey Weinstein. #MeTo…";en;GoldenGlobes;;Denver, Colorado;;;;10/21/10 20:44;MichaelBrownUSA;Michael Brown;Former Under Secretary Homeland Security. Talkers Mag Top 100 Radio Program. Author. International Speaker. Yes, Heckuvajob, Brownie. ن;21432;True;14219;561;6;0;https://t.co/VBKMqryYwc;297;False;False;False;english;"rt @hollywoodintoto: proud to be contributing to the washington times once more!

#goldenglobes telecast to feature harvey weinstein. #meto…";"  proud to be contributing to the washington times once more!

 telecast to feature harvey weinstein. ";proud contributing washington times ! telecast feature harvey weinstein . ;[('proud', 'NN'), ('contributing', 'VBG'), ('washington', 'NN'), ('times', 'NNS'), ('!', '.'), ('telecast', 'NN'), ('feature', 'NN'), ('harvey', 'NN'), ('weinstein', 'NN'), ('.', '.')];proud contribut washington time ! telecast featur harvey weinstein .;proud contribute washington time ! telecast feature harvey weinstein .
87257;twitter;1/5/18 17:38;FALSE;Publicly, We Say #MeToo. Privately, We Have Misgivings. via @NYTimes https://t.co/ux2UdZkoZO;;en;MeToo;nytimes;Tennessee, USA;;;;1/8/09 17:27;re3ecca;Rebecca Tolley;fan of the firm handshake. loves randomness, gin, games, & the kindness of strangers. writer, academic librarian, & single mom. IG: re3ecca;17252;False;1465;1444;0;0;;40;False;False;False;english;publicly, we say #metoo. privately, we have misgivings. via @nytimes https://t.co/ux2udzkozo;publicly, we say  privately, we have misgivings. via  ;publicly , say privately , misgivings . via ;[('publicly', 'RB'), (',', ','), ('say', 'VBP'), ('privately', 'RB'), (',', ','), ('misgivings', 'NNS'), ('.', '.'), ('via', 'IN')];publicli , say privat , misgiv . via;publicly , say privately , misgiving . via
87258;twitter;1/5/18 17:38;FALSE;After #AskHerMore and #MeToo, Time’s Up https://t.co/E4YDPlSHWG https://t.co/Qous6CQgud;;en;AskHerMore, MeToo;;;;;;9/18/16 21:43;AlfonnsErnes;alfonns ernes;;3850;False;1;53;0;0;;0;True;False;False;english;after #askhermore and #metoo, time’s up https://t.co/e4ydplshwg https://t.co/qous6cqgud;after  and  time’s up  ;time ’ ;[('time', 'NN'), ('’', 'NN')];time ’;time ’
87259;twitter;1/5/18 17:38;FALSE;3 Ways #MeToo Will Influence the Business World in 2018 https://t.co/CBBA3VLhb5;;en;MeToo;;;;;;2/29/12 21:25;namentrepreneur;namentrepreneurs;National Association of Minority Entrepreneurs;100188;False;181;14;0;0;http://t.co/UNxx9O3zly;119;False;False;False;english;3 ways #metoo will influence the business world in 2018 https://t.co/cbba3vlhb5;3 ways  will influence the business world in 2018 ;3 ways influence business world 2018 ;[('3', 'CD'), ('ways', 'NNS'), ('influence', 'NN'), ('business', 'NN'), ('world', 'NN'), ('2018', 'CD')];3 way influenc busi world 2018;3 way influence business world 2018
87260;twitter;1/5/18 17:38;FALSE;@James_Beyond Padma Shree #MeToo https://t.co/D80zfZbKyL;;hi;MeToo;James_Beyond;New Delhi, India;;;;10/5/16 17:27;i_upasana;Attraversiamo !!!;A girl with no talent !!!!;33310;False;10705;255;0;0;https://t.co/PSE1uPzqGN;40;True;False;True;hindi;@james_beyond padma shree #metoo https://t.co/d80zfzbkyl; padma shree  ;;[('None', 'NN')];none;None
87261;twitter;1/5/18 17:38;FALSE;Perhaps the Special Prosecutor’s investigation has/is sparked/sparking a MeToo viral run through corporations and political parties that will actually drain the/a swamp. https://t.co/f6PLZeLfjU;;en;;;Chehalis, WA;;;;11/16/12 17:58;RobertPSouthern;🍣 🛸 Lobster Stuffed With Tacos🐱🥡;Writer and Teacher. Church of Jesus Christ of Latter-Day Saints. Husband to 1, Father of 3. Resist with 🚀, 🙏 & 🥑. 🏳️‍🌈 ally.;8329;False;1122;964;0;0;https://t.co/cMNby9eBU2;50;False;False;False;english;perhaps the special prosecutor’s investigation has/is sparked/sparking a metoo viral run through corporations and political parties that will actually drain the/a swamp. https://t.co/f6plzelfju;perhaps the special prosecutor’s investigation has/is sparked/sparking a metoo viral run through corporations and political paies that will actually drain the/a swamp. ;perhaps special prosecutor ’ investigation has/is sparked/sparking metoo viral run corporations political paies actually drain the/a swamp . ;[('perhaps', 'RB'), ('special', 'JJ'), ('prosecutor', 'NN'), ('’', 'NNP'), ('investigation', 'NN'), ('has/is', 'NN'), ('sparked/sparking', 'VBG'), ('metoo', 'JJ'), ('viral', 'JJ'), ('run', 'NN'), ('corporations', 'NNS'), ('political', 'JJ'), ('paies', 'NNS'), ('actually', 'RB'), ('drain', 'VBP'), ('the/a', 'JJ'), ('swamp', 'NN'), ('.', '.')];perhap special prosecutor ’ investig has/i sparked/spark metoo viral run corpor polit pai actual drain the/a swamp .;perhaps special prosecutor ’ investigation has/is sparked/sparking metoo viral run corporation political pay actually drain the/a swamp .
