id;source;created_date;is_retweet;text;text_retweet;language;hashtags;mentions;location;geo_location;geo_country;geo_coordinates;user_created_at;screen_name;name;profile_description;total_number_of_tweets;is_verified;followers_count;friends_count;retweets_count;favorite_count;url;listed_count;default_profile;default_profile_image;has_extended_profile;language_desc;tweet_full;pre_proc_tweet;stop_filter_tweet;pos_tags;stem_filter;lemma_filter
59733;twitter;1/14/18 5:13;TRUE;;"RT @petridishes: oh sorry should have said NOW NOW LADIES SETTLE DOWN https://t.co/cvT1NoIrDK
(I run a business of repute I am the mayor of…";en;;;Iowa;;;;11/10/10 5:09;MollyAnds;Molly;;426;False;25;433;378;0;;0;False;False;False;english;"rt @petridishes: oh sorry should have said now now ladies settle down https://t.co/cvt1noirdk
(i run a business of repute i am the mayor of…";"  oh sorry should have said now now ladies settle down 
(i run a business of repute i am the mayor of…";oh sorry said ladies settle ( run business repute mayor of… ;[('oh', 'UH'), ('sorry', 'NN'), ('said', 'VBD'), ('ladies', 'NNS'), ('settle', 'VBP'), ('(', '('), ('run', 'VB'), ('business', 'NN'), ('repute', 'NN'), ('mayor', 'NN'), ('of…', 'NN')];oh sorri said ladi settl ( run busi reput mayor of…;oh sorry say lady settle ( run business repute mayor of…
59734;twitter;1/14/18 5:13;TRUE;;"RT @sullydish: Time's Up For #MeToo McCarthyism

https://t.co/d2TjMUKfn2 via @intelligencer";en;MeToo;intelligencer;;;;;10/23/16 1:48;Art_of_Immortal;Warrior;;647;False;46;961;139;0;;0;True;False;False;english;"rt @sullydish: time's up for #metoo mccarthyism

https://t.co/d2tjmukfn2 via @intelligencer";"  time's up for  mccahyism

 via ";time 's mccahyism via ;"[('time', 'NN'), (""'s"", 'POS'), ('mccahyism', 'NN'), ('via', 'IN')]";time 's mccahyism via;time 's mccahyism via
59735;twitter;1/14/18 5:13;TRUE;;RT @bairdjulia: It is wrong to call the #metoo movement a witch hunt. The whole point of witch trials in history is that THERE IS NO SUCH T…;en;metoo;;Brisbane, Australia;;;;4/14/13 22:49;MackayIM;ɪᴀɴ ᴍ ᴍᴀᴄᴋᴀʏ, ᴘʜᴅ 🦠🧬🥼🦟;virologist. husband. father. reader. writer. fixer. bad typist. in no order. facts are referenced. opinions mine alone. not medical advice or endorsement.;101505;True;12357;3503;401;0;https://t.co/C9HOVIjnIn;553;False;False;True;english;rt @bairdjulia: it is wrong to call the #metoo movement a witch hunt. the whole point of witch trials in history is that there is no such t…;  it is wrong to call the  movement a witch hunt. the whole point of witch trials in history is that there is no such t…;wrong call movement witch hunt . whole point witch trials history t… ;[('wrong', 'JJ'), ('call', 'JJ'), ('movement', 'NN'), ('witch', 'NN'), ('hunt', 'NN'), ('.', '.'), ('whole', 'JJ'), ('point', 'NN'), ('witch', 'NN'), ('trials', 'NNS'), ('history', 'NN'), ('t…', 'NN')];wrong call movement witch hunt . whole point witch trial histori t…;wrong call movement witch hunt . whole point witch trial history t…
59736;twitter;1/14/18 5:13;TRUE;;"RT @k80way: I talked to a girl who says she went on a date with @azizansari in an exclusive for @babedotnet. She told me, ""It was by far th…";en;;azizansari,babedotnet;New York, NY;;;;3/2/14 20:46;Augusta_fitz;Augusta Fitzgerald;blerg;2603;False;489;376;7821;0;;2;True;False;True;english;"rt @k80way: i talked to a girl who says she went on a date with @azizansari in an exclusive for @babedotnet. she told me, ""it was by far th…";"  i talked to a girl who says she went on a date with  in an exclusive for  she told me, ""it was by far th…";talked girl says went date exclusive told , `` far th… ;[('talked', 'VBN'), ('girl', 'NN'), ('says', 'VBZ'), ('went', 'VBD'), ('date', 'NN'), ('exclusive', 'JJ'), ('told', 'NN'), (',', ','), ('``', '``'), ('far', 'RB'), ('th…', 'JJ')];talk girl say went date exclus told , `` far th…;talk girl say go date exclusive told ,  far th…
59737;twitter;1/14/18 5:11;TRUE;;"RT @heather_hear: Lovely Michelle Williams Statement with her line about Anthony Rapp @albinokid ""for all the shoulders you stood on, now w…";en;;albinokid;LA & NYC;;;;3/15/12 4:21;BrianChinActor;Brian Chin;Actor. Foodie. Animal Rights Activist. Instagram: https://t.co/1cxNL8QxFa #StillWithHer #StrongerTogether #HillaryClinton;43288;False;3175;1305;116;0;https://t.co/kmjmyUHsqn;106;False;False;True;english;"rt @heather_hear: lovely michelle williams statement with her line about anthony rapp @albinokid ""for all the shoulders you stood on, now w…";"  lovely michelle williams statement with her line about anthony rapp  ""for all the shoulders you stood on, now w…";lovely michelle williams statement line anthony rapp `` shoulders stood , w… ;[('lovely', 'RB'), ('michelle', 'JJ'), ('williams', 'NNS'), ('statement', 'NN'), ('line', 'NN'), ('anthony', 'NN'), ('rapp', 'NN'), ('``', '``'), ('shoulders', 'NNS'), ('stood', 'VBD'), (',', ','), ('w…', 'NN')];love michel william statement line anthoni rapp `` shoulder stood , w…;lovely michelle williams statement line anthony rapp  shoulder stand , w…
59738;twitter;1/14/18 5:11;TRUE;;"RT @k80way: I talked to a girl who says she went on a date with @azizansari in an exclusive for @babedotnet. She told me, ""It was by far th…";en;;azizansari,babedotnet;kim - she/her - 26 - USA;;;;4/11/11 12:18;theravenboys;👾👾👾;wanna listen to the king? you look like a yuta fan. #BBN #korraine;192517;False;734;163;7821;0;https://t.co/FJKArSBSej;41;False;False;True;english;"rt @k80way: i talked to a girl who says she went on a date with @azizansari in an exclusive for @babedotnet. she told me, ""it was by far th…";"  i talked to a girl who says she went on a date with  in an exclusive for  she told me, ""it was by far th…";talked girl says went date exclusive told , `` far th… ;[('talked', 'VBN'), ('girl', 'NN'), ('says', 'VBZ'), ('went', 'VBD'), ('date', 'NN'), ('exclusive', 'JJ'), ('told', 'NN'), (',', ','), ('``', '``'), ('far', 'RB'), ('th…', 'JJ')];talk girl say went date exclus told , `` far th…;talk girl say go date exclusive told ,  far th…
59739;twitter;1/14/18 5:11;TRUE;;"RT @bbcmundo: ""La seducción no es un delito"": la polémica carta firmada por Catherine Deneuve y un centenar de artistas francesas contra el…";es;;;Bogotá, Colombia;;;;5/21/11 2:35;elM1RV;m1Rv;MD, internal medicine. lives the delusion that the ultimate meaning of being is to destroy The planet in order to own things.;28699;False;770;662;96;0;https://t.co/hcdFlpGevh;27;False;False;False;spanish;"rt @bbcmundo: ""la seducción no es un delito"": la polémica carta firmada por catherine deneuve y un centenar de artistas francesas contra el…";"  ""la seducción no es un delito"": la polémica caa firmada por catherine deneuve y un centenar de aistas francesas contra el…";`` seducción delito '' : polémica caa firmada catherine deneuve centenar aistas francesas el… ;[('``', '``'), ('seducción', 'NN'), ('delito', 'NN'), ('``', '``'), (':', ':'), ('polémica', 'NN'), ('caa', 'NN'), ('firmada', 'VBP'), ('catherine', 'NN'), ('deneuve', 'NN'), ('centenar', 'NN'), ('aistas', 'NNS'), ('francesas', 'VBP'), ('el…', 'NN')];`` seducción delito `` : polémica caa firmada catherin deneuv centenar aista francesa el…; seducción delito  : polémica caa firmada catherine deneuve centenar aistas francesas el…
59740;twitter;1/14/18 5:12;TRUE;;"RT @k80way: I talked to a girl who says she went on a date with @azizansari in an exclusive for @babedotnet. She told me, ""It was by far th…";en;;azizansari,babedotnet;;;;;1/28/15 1:12;supersonicobain;rkid // leam;BITCHSLAP DYNAMITE DARK COMEDY!!!!;33068;False;722;57;7821;0;;23;False;False;False;english;"rt @k80way: i talked to a girl who says she went on a date with @azizansari in an exclusive for @babedotnet. she told me, ""it was by far th…";"  i talked to a girl who says she went on a date with  in an exclusive for  she told me, ""it was by far th…";talked girl says went date exclusive told , `` far th… ;[('talked', 'VBN'), ('girl', 'NN'), ('says', 'VBZ'), ('went', 'VBD'), ('date', 'NN'), ('exclusive', 'JJ'), ('told', 'NN'), (',', ','), ('``', '``'), ('far', 'RB'), ('th…', 'JJ')];talk girl say went date exclus told , `` far th…;talk girl say go date exclusive told ,  far th…
59741;twitter;1/14/18 5:12;FALSE;The #MeToo  movement is so heartbreaking and an eye opener to how many guys (and females) take advantage of other ppl. I'm glad it's happening but when you realize ppl you idolize have done shitty things it's just like... WOW;;en;MeToo;;;;;;1/2/16 2:02;missmedots;elisha dotson;;1344;False;95;324;0;3;;1;True;False;True;english;the #metoo  movement is so heartbreaking and an eye opener to how many guys (and females) take advantage of other ppl. i am glad it is happening but when you realize ppl you idolize have done shitty things it is just like... wow;the   movement is so heabreaking and an eye opener to how many guys (and females) take advantage of other ppl. i am glad it is happening but when you realize ppl you idolize have done shitty things it is just like... wow;movement heabreaking eye opener many guys ( females ) take advantage ppl . glad happening realize ppl idolize done shitty things like ... wow ;[('movement', 'NN'), ('heabreaking', 'VBG'), ('eye', 'NN'), ('opener', 'RB'), ('many', 'JJ'), ('guys', 'NNS'), ('(', '('), ('females', 'NNS'), (')', ')'), ('take', 'VBP'), ('advantage', 'NN'), ('ppl', 'NN'), ('.', '.'), ('glad', 'JJ'), ('happening', 'VBG'), ('realize', 'NN'), ('ppl', 'NN'), ('idolize', 'VB'), ('done', 'VBN'), ('shitty', 'JJ'), ('things', 'NNS'), ('like', 'IN'), ('...', ':'), ('wow', 'NN')];movement heabreak eye open mani guy ( femal ) take advantag ppl . glad happen realiz ppl idol done shitti thing like ... wow;movement heabreaking eye opener many guy ( female ) take advantage ppl . glad happen realize ppl idolize do shitty thing like ... wow
59742;twitter;1/14/18 5:12;TRUE;;"RT @k80way: I talked to a girl who says she went on a date with @azizansari in an exclusive for @babedotnet. She told me, ""It was by far th…";en;;azizansari,babedotnet;313;;;;8/22/11 21:37;Want_A_Battle;Toni Snaxton;Just trying to spread the gospel...that hoe is life 🙏✨1st impressions start here https://t.co/SLPQ5jomIY 🐝🐝🐝;119326;False;329;295;7821;0;;24;False;False;True;english;"rt @k80way: i talked to a girl who says she went on a date with @azizansari in an exclusive for @babedotnet. she told me, ""it was by far th…";"  i talked to a girl who says she went on a date with  in an exclusive for  she told me, ""it was by far th…";talked girl says went date exclusive told , `` far th… ;[('talked', 'VBN'), ('girl', 'NN'), ('says', 'VBZ'), ('went', 'VBD'), ('date', 'NN'), ('exclusive', 'JJ'), ('told', 'NN'), (',', ','), ('``', '``'), ('far', 'RB'), ('th…', 'JJ')];talk girl say went date exclus told , `` far th…;talk girl say go date exclusive told ,  far th…
59743;twitter;1/14/18 5:12;TRUE;;"RT @BethGoldHux: Democrats should all stay away from Trump’s SOTU

Instead, they should give up all their seats to folks representing #MeToo";en;MeToo;;;;;;11/2/17 22:43;ImStillRealAF;Black Men Matter;The Last Of A Dying Breed...;5364;False;224;420;5;0;;5;False;False;False;english;"rt @bethgoldhux: democrats should all stay away from trump’s sotu

instead, they should give up all their seats to folks representing #metoo";"  democrats should all stay away from trump’s sotu

instead, they should give up all their seats to folks representing ";democrats stay away trump ’ sotu instead , give seats folks representing ;[('democrats', 'NNS'), ('stay', 'VBP'), ('away', 'RB'), ('trump', 'JJ'), ('’', 'NNP'), ('sotu', 'NN'), ('instead', 'RB'), (',', ','), ('give', 'VB'), ('seats', 'NNS'), ('folks', 'NNS'), ('representing', 'VBG')];democrat stay away trump ’ sotu instead , give seat folk repres;democrat stay away trump ’ sotu instead , give seat folk represent
59744;twitter;1/14/18 5:12;FALSE;The scary thing about the #metoo movement is that for every hashtag, there is a man that someone knows that did that.;;en;metoo;;here;;;;1/25/12 13:09;MaskusNancy;nance pants;;33;False;9;38;0;0;;0;True;False;False;english;the scary thing about the #metoo movement is that for every hashtag, there is a man that someone knows that did that.;the scary thing about the  movement is that for every hashtag, there is a man that someone knows that did that.;scary thing movement every hashtag , man someone knows . ;[('scary', 'JJ'), ('thing', 'NN'), ('movement', 'NN'), ('every', 'DT'), ('hashtag', 'NN'), (',', ','), ('man', 'NN'), ('someone', 'NN'), ('knows', 'VBZ'), ('.', '.')];scari thing movement everi hashtag , man someon know .;scary thing movement every hashtag , man someone know .
59745;twitter;1/14/18 5:12;FALSE;"Disappointed with all the media hype over the ""#metoo"" hysteria, Bill Cosby would like to remind everyone #mefirst!";;en;metoo, mefirst;;;;;;1/31/12 18:52;dkisfunny;dkisfunny;tax geek wanting to be a comedy writer;486;False;16;12;0;0;;0;True;False;False;english;"disappointed with all the media hype over the ""#metoo"" hysteria, bill cosby would like to remind everyone #mefirst!";"disappointed with all the media hype over the "" hysteria, bill cosby would like to remind everyone ";disappointed media hype `` hysteria , bill cosby would like remind everyone ;[('disappointed', 'JJ'), ('media', 'NNS'), ('hype', 'NN'), ('``', '``'), ('hysteria', 'NN'), (',', ','), ('bill', 'NN'), ('cosby', 'NN'), ('would', 'MD'), ('like', 'VB'), ('remind', 'VB'), ('everyone', 'NN')];disappoint media hype `` hysteria , bill cosbi would like remind everyon;disappointed medium hype  hysteria , bill cosby would like remind everyone
59746;twitter;1/14/18 5:12;TRUE;;"RT @Jess_McAllen: ""There will be prominent New Zealand men fearful right now that confidentiality agreements will be breached by angry vict…";en;;;Auckland, New Zealand;;;;8/24/14 4:16;carmenjleonard;Carmen Leonard;Television Producer, passionate local content supporter, wife and mother of one gorgeous son.;6001;False;664;418;30;0;;12;True;False;False;english;"rt @jess_mcallen: ""there will be prominent new zealand men fearful right now that confidentiality agreements will be breached by angry vict…";"  ""there will be prominent new zealand men fearful right now that confidentiality agreements will be breached by angry vict…";`` prominent new zealand men fearful right confidentiality agreements breached angry vict… ;[('``', '``'), ('prominent', 'JJ'), ('new', 'JJ'), ('zealand', 'NN'), ('men', 'NNS'), ('fearful', 'JJ'), ('right', 'JJ'), ('confidentiality', 'NN'), ('agreements', 'NNS'), ('breached', 'VBD'), ('angry', 'JJ'), ('vict…', 'NN')];`` promin new zealand men fear right confidenti agreement breach angri vict…; prominent new zealand men fearful right confidentiality agreement breach angry vict…
59747;twitter;1/14/18 5:10;TRUE;;"RT @k80way: I talked to a girl who says she went on a date with @azizansari in an exclusive for @babedotnet. She told me, ""It was by far th…";en;;azizansari,babedotnet;San Diego, CA;;;;6/21/09 19:16;Alexisdjgc;Alexis;"22. CSUSM ‘19. Defend DACA. ""It's coexistence or no existence.” ...sc:Alexisdjgc";88500;False;1042;1016;7821;0;http://Instagram.com/Alexisdjgc;16;False;False;True;english;"rt @k80way: i talked to a girl who says she went on a date with @azizansari in an exclusive for @babedotnet. she told me, ""it was by far th…";"  i talked to a girl who says she went on a date with  in an exclusive for  she told me, ""it was by far th…";talked girl says went date exclusive told , `` far th… ;[('talked', 'VBN'), ('girl', 'NN'), ('says', 'VBZ'), ('went', 'VBD'), ('date', 'NN'), ('exclusive', 'JJ'), ('told', 'NN'), (',', ','), ('``', '``'), ('far', 'RB'), ('th…', 'JJ')];talk girl say went date exclus told , `` far th…;talk girl say go date exclusive told ,  far th…
59748;twitter;1/14/18 5:10;TRUE;;"RT @PerezHilton: #LiamNeeson thinks the #MeToo and #TimesUp movements have created a ""witch hunt"" against men: https://t.co/ZokkxwPacv http…";en;LiamNeeson, MeToo, TimesUp;;SJ/NY/MIA/MCO;;;;10/11/09 5:20;htjlaw;htj;Attorney/empresario/literato/filántropo de las luces/tengo defectos, pero quien no los tiene? 👨🏻‍🚒;128810;False;2210;2945;23;0;;43;True;False;True;english;"rt @perezhilton: #liamneeson thinks the #metoo and #timesup movements have created a ""witch hunt"" against men: https://t.co/zokkxwpacv http…";"   thinks the  and  movements have created a ""witch hunt"" against men:  ";thinks movements created `` witch hunt '' men : ;[('thinks', 'NNS'), ('movements', 'NNS'), ('created', 'VBD'), ('``', '``'), ('witch', 'NN'), ('hunt', 'NN'), ('``', '``'), ('men', 'NNS'), (':', ':')];think movement creat `` witch hunt `` men :;think movement create  witch hunt  men :
59749;twitter;1/14/18 5:10;TRUE;;RT @monaeltahawy: My latest: Catherine Deneuve, et al. are not defending brown or black men’s “freedom to pester.”  The men and the “cultur…;en;;;Doha & Bengaluru;;;;4/30/09 16:04;vanish_forever;Vani Saraswathi;Associate Editor & Director of Projects @MigrantRights. Author: Stories of Origin (https://t.co/iTRfBSVTlt). The Middle Way. To die mid-laugh #lifegoals.;16475;True;3925;280;341;0;https://t.co/nx9ZvARVHs;70;False;False;False;english;rt @monaeltahawy: my latest: catherine deneuve, et al. are not defending brown or black men’s “freedom to pester.”  the men and the “cultur…;  my latest: catherine deneuve, et al. are not defending brown or black men’s “freedom to pester.”  the men and the “cultur…;latest : catherine deneuve , et al . defending brown black men ’ “ freedom pester. ” men “ cultur… ;[('latest', 'JJS'), (':', ':'), ('catherine', 'NN'), ('deneuve', 'NN'), (',', ','), ('et', 'CC'), ('al', 'NN'), ('.', '.'), ('defending', 'VBG'), ('brown', 'JJ'), ('black', 'JJ'), ('men', 'NNS'), ('’', 'VBP'), ('“', 'NN'), ('freedom', 'NN'), ('pester', 'NN'), ('.', '.'), ('”', 'JJ'), ('men', 'NNS'), ('“', 'VBP'), ('cultur…', 'NN')];latest : catherin deneuv , et al . defend brown black men ’ “ freedom pester . ” men “ cultur…;late : catherine deneuve , et al . defend brown black men ’  freedom pester .  men  cultur…
59750;twitter;1/14/18 5:11;TRUE;;RT @DannaGarcia: Me uno a todas las mujeres que hoy se vistieron de negro. Hoy mad que nunca el respeto y la dignidad en areas de trabajo s…;es;;;;;;;9/27/16 23:26;selmacostacd;Selma Costa;;2699;False;66;45;64;0;;0;True;False;True;spanish;rt @dannagarcia: me uno a todas las mujeres que hoy se vistieron de negro. hoy mad que nunca el respeto y la dignidad en areas de trabajo s…;  me uno a todas las mujeres que hoy se vistieron de negro. hoy mad que nunca el respeto y la dignidad en areas de trabajo s…;todas mujeres hoy vistieron negro . hoy mad nunca respeto dignidad areas trabajo s… ;[('todas', 'JJ'), ('mujeres', 'NNS'), ('hoy', 'VBP'), ('vistieron', 'NN'), ('negro', 'NN'), ('.', '.'), ('hoy', 'NN'), ('mad', 'JJ'), ('nunca', 'JJ'), ('respeto', 'NN'), ('dignidad', 'NN'), ('areas', 'NNS'), ('trabajo', 'VBP'), ('s…', 'NN')];toda mujer hoy vistieron negro . hoy mad nunca respeto dignidad area trabajo s…;todas mujeres hoy vistieron negro . hoy mad nunca respeto dignidad area trabajo s…
59751;twitter;1/14/18 5:11;TRUE;;"RT @funder: Dear Republicans-Quit acting like you support #MeToo &amp; #TimesUp—but then act like Trump hasn’t sexually assaulted 20 women. It’…";en;MeToo, TimesUp;;USA;;;;12/12/13 16:17;helwiger60;Lisa HP;#ResignTrump. #TheResistance. #MeToo, #BanAssaultWeapons #NoRA.  Well-educated, working poor. Disillusioned with government. Respect earth & its creatures.;14134;False;840;2921;1252;0;;3;True;False;False;english;"rt @funder: dear republicans-quit acting like you support #metoo &amp; #timesup—but then act like trump hasn’t sexually assaulted 20 women. it’…";"  dear republicans-quit acting like you suppo  &amp;  then act like trump hasn’t sexually assaulted 20 women. it’…";"dear republicans-quit acting like suppo & amp ; act like trump ’ sexually assaulted 20 women . ’ … ";"[('dear', 'JJ'), ('republicans-quit', 'NN'), ('acting', 'VBG'), ('like', 'IN'), ('suppo', 'NN'), ('&', 'CC'), ('amp', 'NN'), (';', ':'), ('act', 'NN'), ('like', 'IN'), ('trump', 'NN'), ('’', 'NNP'), ('sexually', 'RB'), ('assaulted', 'VBD'), ('20', 'CD'), ('women', 'NNS'), ('.', '.'), ('’', 'CD'), ('…', 'NN')]";"dear republicans-quit act like suppo & amp ; act like trump ’ sexual assault 20 women . ’ …";"dear republicans-quit act like suppo & amp ; act like trump ’ sexually assault 20 woman . ’ …"
59752;twitter;1/14/18 5:11;FALSE;Vraiment excellent! Dommage qu’il n’y ait pas une version anglaise pour tous ces coincés du cul de Ricains qui se gargarisent avec #MeToo et se scandalisent de la déclaration de C. Deneuve. https://t.co/dbBtvwdkQx;;fr;MeToo;;Nantes, France;;;;9/10/14 20:24;jhvtgr;vtgr;;3948;False;159;322;0;0;;10;True;False;False;french;vraiment excellent! dommage qu’il n’y ait pas une version anglaise pour tous ces coincés du cul de ricains qui se gargarisent avec #metoo et se scandalisent de la déclaration de c. deneuve. https://t.co/dbbtvwdkqx;vraiment excellent! dommage qu’il n’y ait pas une version anglaise pour tous ces coincés du cul de ricains qui se gargarisent avec  et se scandalisent de la déclaration de c. deneuve. ;vraiment excellent ! dommage ’ ’ version anglaise tous coincés cul ricains gargarisent scandalisent déclaration c. deneuve . ;[('vraiment', 'JJ'), ('excellent', 'NN'), ('!', '.'), ('dommage', 'NN'), ('’', 'JJ'), ('’', 'NNP'), ('version', 'NN'), ('anglaise', 'RB'), ('tous', 'JJ'), ('coincés', 'NNS'), ('cul', 'VBP'), ('ricains', 'NNS'), ('gargarisent', 'JJ'), ('scandalisent', 'JJ'), ('déclaration', 'NN'), ('c.', 'NN'), ('deneuve', 'NN'), ('.', '.')];vraiment excel ! dommag ’ ’ version anglais tou coincé cul ricain gargaris scandalis déclarat c. deneuv .;vraiment excellent ! dommage ’ ’ version anglaise tous coincés cul ricains gargarisent scandalisent déclaration c. deneuve .
59754;twitter;1/14/18 5:11;FALSE;There are so many new accusations out there for the MeToo Movement. Good for the women who are being truthful about their encounters, but I feel like some of them are just trying to get revenge. NOT SAYING THIS IS TRUE FOR EVERYTHING, BUT SOME ACCUSATIONS HAVE BEEN SUSPICIOUS.;;en;;;North Carolina, USA;;;;2/20/14 13:39;Scistrike;Nick🔜PAX EAST 🌐;A guy who plays games on the Internet for the heck of it. Memes present. scigamersubmissions@gmail.com https://t.co/BLSPiGjUXm;31553;False;934;341;0;3;https://t.co/0xnFAIUVFV;11;False;False;True;english;there are so many new accusations out there for the metoo movement. good for the women who are being truthful about their encounters, but i feel like some of them are just trying to get revenge. not saying this is true for everything, but some accusations have been suspicious.;there are so many new accusations out there for the metoo movement. good for the women who are being truthful about their encounters, but i feel like some of them are just trying to get revenge. not saying this is true for everything, but some accusations have been suspicious.;many new accusations metoo movement . good women truthful encounters , feel like trying get revenge . saying true everything , accusations suspicious . ;[('many', 'JJ'), ('new', 'JJ'), ('accusations', 'NNS'), ('metoo', 'VBP'), ('movement', 'NN'), ('.', '.'), ('good', 'JJ'), ('women', 'NNS'), ('truthful', 'JJ'), ('encounters', 'NNS'), (',', ','), ('feel', 'VBP'), ('like', 'IN'), ('trying', 'VBG'), ('get', 'VB'), ('revenge', 'NN'), ('.', '.'), ('saying', 'VBG'), ('true', 'JJ'), ('everything', 'NN'), (',', ','), ('accusations', 'NNS'), ('suspicious', 'VBP'), ('.', '.')];mani new accus metoo movement . good women truth encount , feel like tri get reveng . say true everyth , accus suspici .;many new accusation metoo movement . good woman truthful encounter , feel like try get revenge . say true everything , accusation suspicious .
59755;twitter;1/14/18 5:11;TRUE;;"RT @k80way: I talked to a girl who says she went on a date with @azizansari in an exclusive for @babedotnet. She told me, ""It was by far th…";en;;azizansari,babedotnet;stolen lenape land;;;;10/15/14 0:32;noraxegf;🏳️‍🌈⃠🥰🏳️‍🌈⃠;"eleanor ; she/her";7672;False;394;239;7821;0;;4;True;False;False;english;"rt @k80way: i talked to a girl who says she went on a date with @azizansari in an exclusive for @babedotnet. she told me, ""it was by far th…";"  i talked to a girl who says she went on a date with  in an exclusive for  she told me, ""it was by far th…";talked girl says went date exclusive told , `` far th… ;[('talked', 'VBN'), ('girl', 'NN'), ('says', 'VBZ'), ('went', 'VBD'), ('date', 'NN'), ('exclusive', 'JJ'), ('told', 'NN'), (',', ','), ('``', '``'), ('far', 'RB'), ('th…', 'JJ')];talk girl say went date exclus told , `` far th…;talk girl say go date exclusive told ,  far th…
