id;source;created_date;is_retweet;text;text_retweet;language;hashtags;mentions;location;geo_location;geo_country;geo_coordinates;user_created_at;screen_name;name;profile_description;total_number_of_tweets;is_verified;followers_count;friends_count;retweets_count;favorite_count;url;listed_count;default_profile;default_profile_image;has_extended_profile;language_desc;tweet_full;pre_proc_tweet;stop_filter_tweet;pos_tags;stem_filter;lemma_filter
59271;twitter;1/14/18 8:02;FALSE;@sadydoyle Halfway through that article it is obvious that this guy Aziz ansari was framed by this girl. People trying to get onto the #metoo bandwagon. Poor ansari.;;en;metoo;sadydoyle;;;;;8/14/16 14:48;Logicator1;Logicator;;1948;False;12;27;0;1;;2;True;False;False;english;@sadydoyle halfway through that article it is obvious that this guy aziz ansari was framed by this girl. people trying to get onto the #metoo bandwagon. poor ansari.; halfway through that aicle it is obvious that this guy aziz ansari was framed by this girl. people trying to get onto the  bandwagon. poor ansari.;halfway aicle obvious guy aziz ansari framed girl . people trying get onto bandwagon . poor ansari . ;[('halfway', 'RB'), ('aicle', 'RB'), ('obvious', 'JJ'), ('guy', 'NN'), ('aziz', 'NN'), ('ansari', 'NN'), ('framed', 'VBD'), ('girl', 'JJ'), ('.', '.'), ('people', 'NNS'), ('trying', 'VBG'), ('get', 'VB'), ('onto', 'IN'), ('bandwagon', 'NN'), ('.', '.'), ('poor', 'JJ'), ('ansari', 'NN'), ('.', '.')];halfway aicl obviou guy aziz ansari frame girl . peopl tri get onto bandwagon . poor ansari .;halfway aicle obvious guy aziz ansari frame girl . people try get onto bandwagon . poor ansari .
59272;twitter;1/14/18 8:02;TRUE;;RT @TheConWom: An interesting read here - After the #MeToo backlash, an insider’s guide to French feminism https://t.co/gf6lMv0fBf;en;MeToo;;;;;;2/19/17 21:23;JackKaj3;jack taylor;;15156;False;76;76;2;0;;0;True;True;False;english;rt @theconwom: an interesting read here - after the #metoo backlash, an insider’s guide to french feminism https://t.co/gf6lmv0fbf;  an interesting read here - after the  backlash, an insider’s guide to french feminism ;interesting read - backlash , insider ’ guide french feminism ;[('interesting', 'VBG'), ('read', 'JJ'), ('-', ':'), ('backlash', 'NN'), (',', ','), ('insider', 'NN'), ('’', 'NNP'), ('guide', 'NN'), ('french', 'JJ'), ('feminism', 'NN')];interest read - backlash , insid ’ guid french femin;interest read - backlash , insider ’ guide french feminism
59273;twitter;1/14/18 8:02;TRUE;;RT @CHSommers: This baseless attack on Aziz Ansari trivializes the #Metoo movement. #WitchHunt https://t.co/Z5EUhCUEZJ;en;Metoo, WitchHunt;;Bengaluru South, India;;;;12/4/10 8:50;seyrup;Bharath Reddy;Software engineer, aspiring Mathematician.;35633;False;1183;482;671;0;;22;True;False;True;english;rt @chsommers: this baseless attack on aziz ansari trivializes the #metoo movement. #witchhunt https://t.co/z5euhcuezj;  this baseless attack on aziz ansari trivializes the  movement.  ;baseless attack aziz ansari trivializes movement . ;[('baseless', 'JJ'), ('attack', 'NN'), ('aziz', 'NN'), ('ansari', 'NN'), ('trivializes', 'VBZ'), ('movement', 'NN'), ('.', '.')];baseless attack aziz ansari trivial movement .;baseless attack aziz ansari trivialize movement .
59274;twitter;1/14/18 8:02;TRUE;;RT @charlesmurray: I hadn't seen a thoughtful article about the excesses of the MeToo movement until now. Is it possible people are scared…;en;;;New york, NY;;;;5/5/10 15:54;LudicScholar;Shashank Pawar;Doctoral student studying Games & Learning. Real madrid fan. Gamer.;1109;False;192;212;264;0;https://t.co/G94Ymz5YQr;8;True;False;False;english;rt @charlesmurray: i hadn't seen a thoughtful article about the excesses of the metoo movement until now. is it possible people are scared…;  i hadn't seen a thoughtful aicle about the excesses of the metoo movement until now. is it possible people are scared…;n't seen thoughtful aicle excesses metoo movement . possible people scared… ;"[(""n't"", 'RB'), ('seen', 'VBN'), ('thoughtful', 'JJ'), ('aicle', 'NN'), ('excesses', 'NNS'), ('metoo', 'VBP'), ('movement', 'NN'), ('.', '.'), ('possible', 'JJ'), ('people', 'NNS'), ('scared…', 'VBP')]";n't seen thought aicl excess metoo movement . possibl peopl scared…;n't see thoughtful aicle excess metoo movement . possible people scared…
59275;twitter;1/14/18 8:02;TRUE;;RT @CHSommers: This baseless attack on Aziz Ansari trivializes the #Metoo movement. #WitchHunt https://t.co/Z5EUhCUEZJ;en;Metoo, WitchHunt;;El Paso, TX;;;;9/28/15 17:18;lisathegeekmom;Lisa Kay Tate;I Celebrate Creativity! #MakeThings #Write #Read #Draw #Dance  Core contributor @GeekMomBlog  Writer for @theloftusparty  @drivetribes Hubby: @minionfeeding101;22606;False;1770;2959;671;0;https://t.co/DconbCFUPd;102;False;False;True;english;rt @chsommers: this baseless attack on aziz ansari trivializes the #metoo movement. #witchhunt https://t.co/z5euhcuezj;  this baseless attack on aziz ansari trivializes the  movement.  ;baseless attack aziz ansari trivializes movement . ;[('baseless', 'JJ'), ('attack', 'NN'), ('aziz', 'NN'), ('ansari', 'NN'), ('trivializes', 'VBZ'), ('movement', 'NN'), ('.', '.')];baseless attack aziz ansari trivial movement .;baseless attack aziz ansari trivialize movement .
59276;twitter;1/14/18 8:01;FALSE;I can’t believe I actually just read a tweet telling someone they aren’t a victim because they weren’t raped. So there are rules to be apart of the #metoo movement? No. Fuck that. What do you not get about supporting women, all women, EVERY SINCE ONE.;;en;metoo;;;;;;8/12/09 21:12;ShelbyDivine;Shelby;I took all my things that make sounds, the rest I can do without. 🖤;34639;False;408;154;0;0;;1;False;False;True;english;i can’t believe i actually just read a tweet telling someone they aren’t a victim because they weren’t raped. so there are rules to be apart of the #metoo movement? no. fuck that. what do you not get about supporting women, all women, every since one.;i can’t believe i actually just read a tweet telling someone they aren’t a victim because they weren’t raped. so there are rules to be apa of the  movement? no. fuck that. what do you not get about suppoing women, all women, every since one.;’ believe actually read tweet telling someone ’ victim ’ raped . rules apa movement ? . fuck . get suppoing women , women , every since one . ;[('’', 'JJ'), ('believe', 'VBP'), ('actually', 'RB'), ('read', 'JJ'), ('tweet', 'NN'), ('telling', 'VBG'), ('someone', 'NN'), ('’', 'NNP'), ('victim', 'NN'), ('’', 'NNP'), ('raped', 'VBD'), ('.', '.'), ('rules', 'NNS'), ('apa', 'VBP'), ('movement', 'NN'), ('?', '.'), ('.', '.'), ('fuck', 'NN'), ('.', '.'), ('get', 'VB'), ('suppoing', 'JJ'), ('women', 'NNS'), (',', ','), ('women', 'NNS'), (',', ','), ('every', 'DT'), ('since', 'IN'), ('one', 'CD'), ('.', '.')];’ believ actual read tweet tell someon ’ victim ’ rape . rule apa movement ? . fuck . get suppo women , women , everi sinc one .;’ believe actually read tweet tell someone ’ victim ’ rap . rule apa movement ? . fuck . get suppoing woman , woman , every since one .
59277;twitter;1/14/18 8:01;FALSE;SKY TG24 - Steven Spielberg contro Deneuve: #MeToo non è una caccia alle streghe https://t.co/x2F9tvqAgj #Pagina Nuova #Press;;it;MeToo, Pagina, Press;; Torino, Italy;;;;12/14/08 1:43;PaginaNuova;Pagina Nuova;"Pagina Nuova è un news magazine multimediale dedicato alla cultura, all'attualità e allo sport, che dedica grande attenzione ai libri. 
La conoscenza condivisa!";1230287;False;1061;493;0;0;http://t.co/oVI8IQumjQ;169;False;False;False;italian;sky tg24 - steven spielberg contro deneuve: #metoo non è una caccia alle streghe https://t.co/x2f9tvqagj #pagina nuova #press;sky tg24 - steven spielberg contro deneuve:  non è una caccia alle streghe   nuova ;sky tg24 - steven spielberg deneuve : caccia streghe nuova ;[('sky', 'NN'), ('tg24', 'SYM'), ('-', ':'), ('steven', 'JJ'), ('spielberg', 'JJ'), ('deneuve', 'NN'), (':', ':'), ('caccia', 'NN'), ('streghe', 'NN'), ('nuova', 'NN')];sky tg24 - steven spielberg deneuv : caccia stregh nuova;sky tg24 - steven spielberg deneuve : caccia streghe nuova
59278;twitter;1/14/18 8:01;FALSE;France's celebrity pushback against 'MeToo' https://t.co/JkyGVYgbVK #BBC #BBCNews #News #RT;;en;BBC, BBCNews, News, RT;;United Kingdom;;;;8/20/11 21:44;Insidify;Insidify;I'm mostly a Gamer and you can find out about most of my goings on from @Insidific;95460;False;1678;926;0;0;http://t.co/Tmw9UAPlZv;111;False;False;False;english;france's celebrity pushback against 'metoo' https://t.co/jkygvygbvk #bbc #bbcnews #news #rt;france's celebrity pushback against 'metoo'     #;france 's celebrity pushback 'metoo ' # ;"[('france', 'NN'), (""'s"", 'POS'), ('celebrity', 'NN'), ('pushback', 'NN'), (""'metoo"", 'NNP'), (""'"", 'POS'), ('#', '#')]";franc 's celebr pushback 'metoo ' #;france 's celebrity pushback 'metoo ' #
59279;twitter;1/14/18 8:01;TRUE;;"RT @k80way: I talked to a girl who says she went on a date with @azizansari in an exclusive for @babedotnet. She told me, ""It was by far th…";en;;azizansari,babedotnet;New Delhi;;;;9/11/09 16:34;rghvpandey;Chowkidar germanirish;#modioncemore;48590;False;681;2069;7821;0;;29;False;False;False;english;"rt @k80way: i talked to a girl who says she went on a date with @azizansari in an exclusive for @babedotnet. she told me, ""it was by far th…";"  i talked to a girl who says she went on a date with  in an exclusive for  she told me, ""it was by far th…";talked girl says went date exclusive told , `` far th… ;[('talked', 'VBN'), ('girl', 'NN'), ('says', 'VBZ'), ('went', 'VBD'), ('date', 'NN'), ('exclusive', 'JJ'), ('told', 'NN'), (',', ','), ('``', '``'), ('far', 'RB'), ('th…', 'JJ')];talk girl say went date exclus told , `` far th…;talk girl say go date exclusive told ,  far th…
59281;twitter;1/14/18 8:01;TRUE;;RT @CherylM7777: I think the #MeToo movement has officially become a joke with that Aziz Ansari story. Bad dates and regret do not equal se…;en;MeToo;;New York, USA;;;;6/30/14 21:02;Gianni_Montero;Gixnni;18 Singer|Producer NY;280;False;60;127;20;0;https://t.co/fe1ZScbVYm;0;False;False;True;english;rt @cherylm7777: i think the #metoo movement has officially become a joke with that aziz ansari story. bad dates and regret do not equal se…;  i think the  movement has officially become a joke with that aziz ansari story. bad dates and regret do not equal se…;think movement officially become joke aziz ansari story . bad dates regret equal se… ;[('think', 'VB'), ('movement', 'NN'), ('officially', 'RB'), ('become', 'VBN'), ('joke', 'NN'), ('aziz', 'JJ'), ('ansari', 'JJ'), ('story', 'NN'), ('.', '.'), ('bad', 'JJ'), ('dates', 'NNS'), ('regret', 'VBP'), ('equal', 'JJ'), ('se…', 'NN')];think movement offici becom joke aziz ansari stori . bad date regret equal se…;think movement officially become joke aziz ansari story . bad date regret equal se…
59282;twitter;1/14/18 8:01;FALSE;France's celebrity pushback against 'MeToo' https://t.co/JPcFsICft3;;en;;;Ivins, UT;;;;3/16/14 21:30;thunderbluex76;Steve Lemke;Angels, Lakers and Rams Fan, semi-tall guy and resident of the Beehive State;421592;False;1523;1895;0;0;;336;False;False;False;english;france's celebrity pushback against 'metoo' https://t.co/jpcfsicft3;france's celebrity pushback against 'metoo' ;france 's celebrity pushback 'metoo ' ;"[('france', 'NN'), (""'s"", 'POS'), ('celebrity', 'NN'), ('pushback', 'NN'), (""'metoo"", 'POS'), (""'"", ""''"")]";franc 's celebr pushback 'metoo ';france 's celebrity pushback 'metoo '
59283;twitter;1/14/18 8:01;TRUE;;"RT @TheWrap: Liam Neeson Defends Dustin Hoffman, Garrison Keillor; Calls #MeToo 'a Bit of a Witch Hunt' https://t.co/AuV6xtYRuV https://t.c…";en;MeToo;;;;;;2/21/17 20:13;HussainWehbe;💭;Film lover, Omni-Otaku & Part-Time Sith;6036;False;58;171;16;0;https://t.co/XnZjum5IQP;2;False;False;True;english;"rt @thewrap: liam neeson defends dustin hoffman, garrison keillor; calls #metoo 'a bit of a witch hunt' https://t.co/auv6xtyruv https://t.c…";"  liam neeson defends dustin hoffman, garrison keillor; calls  'a bit of a witch hunt'  ";"liam neeson defends dustin hoffman , garrison keillor ; calls 'a bit witch hunt ' ";"[('liam', 'NN'), ('neeson', 'NN'), ('defends', 'VBZ'), ('dustin', 'JJ'), ('hoffman', 'NN'), (',', ','), ('garrison', 'JJ'), ('keillor', 'NN'), (';', ':'), ('calls', 'VBZ'), (""'a"", 'CD'), ('bit', 'NN'), ('witch', 'JJ'), ('hunt', 'NN'), (""'"", ""''"")]";"liam neeson defend dustin hoffman , garrison keillor ; call 'a bit witch hunt '";"liam neeson defend dustin hoffman , garrison keillor ; call 'a bit witch hunt '"
59284;twitter;1/14/18 8:01;TRUE;;"RT @k80way: I talked to a girl who says she went on a date with @azizansari in an exclusive for @babedotnet. She told me, ""It was by far th…";en;;azizansari,babedotnet;;;;;11/18/14 0:05;juicegorl;angel;back on my bullshit // leo!!;3642;False;145;240;7821;0;;1;True;False;True;english;"rt @k80way: i talked to a girl who says she went on a date with @azizansari in an exclusive for @babedotnet. she told me, ""it was by far th…";"  i talked to a girl who says she went on a date with  in an exclusive for  she told me, ""it was by far th…";talked girl says went date exclusive told , `` far th… ;[('talked', 'VBN'), ('girl', 'NN'), ('says', 'VBZ'), ('went', 'VBD'), ('date', 'NN'), ('exclusive', 'JJ'), ('told', 'NN'), (',', ','), ('``', '``'), ('far', 'RB'), ('th…', 'JJ')];talk girl say went date exclus told , `` far th…;talk girl say go date exclusive told ,  far th…
59285;twitter;1/14/18 8:01;TRUE;;RT @CHSommers: This baseless attack on Aziz Ansari trivializes the #Metoo movement. #WitchHunt https://t.co/Z5EUhCUEZJ;en;Metoo, WitchHunt;;Bowling Green, KY;;;;3/8/17 16:30;cawright0;Conner Wright;21. wku;398;False;40;178;671;0;;2;True;False;True;english;rt @chsommers: this baseless attack on aziz ansari trivializes the #metoo movement. #witchhunt https://t.co/z5euhcuezj;  this baseless attack on aziz ansari trivializes the  movement.  ;baseless attack aziz ansari trivializes movement . ;[('baseless', 'JJ'), ('attack', 'NN'), ('aziz', 'NN'), ('ansari', 'NN'), ('trivializes', 'VBZ'), ('movement', 'NN'), ('.', '.')];baseless attack aziz ansari trivial movement .;baseless attack aziz ansari trivialize movement .
59288;twitter;1/14/18 8:01;TRUE;;RT @hipslikePC: Why is it ok now for people to take a stand against Woody Allen? When Dylan Farrow came forward some 24 years ago.. I hope…;en;;;PCs Wifey;;;;11/3/17 18:25;xoxpriyankaxox;𝕞𝕪𝕝𝕒;I was PC’s wifey first 💁‍♀️ #PCManiac for life! 🕉 Haters gonna hate..tomatoes gonna tomate and rotis gonna rotate..🌈❤️PC RTed on 04/02/18 at 3:34am😭💗🤩;8541;False;904;156;3;0;https://t.co/LStBnlm3Cx;2;False;False;True;english;rt @hipslikepc: why is it ok now for people to take a stand against woody allen? when dylan farrow came forward some 24 years ago.. i hope…;  why is it ok now for people to take a stand against woody allen? when dylan farrow came forward some 24 years ago.. i hope…;ok people take stand woody allen ? dylan farrow came forward 24 years ago.. hope… ;[('ok', 'JJ'), ('people', 'NNS'), ('take', 'VBP'), ('stand', 'VBP'), ('woody', 'NN'), ('allen', 'VBN'), ('?', '.'), ('dylan', 'NN'), ('farrow', 'NN'), ('came', 'VBD'), ('forward', 'RB'), ('24', 'CD'), ('years', 'NNS'), ('ago..', 'RB'), ('hope…', 'VBP')];ok peopl take stand woodi allen ? dylan farrow came forward 24 year ago.. hope…;ok people take stand woody allen ? dylan farrow come forward 24 year ago.. hope…
59289;twitter;1/14/18 8:01;FALSE;. A French porn star-turned-agony aunt who joined 99 other women condemning the #MeToo movement has claimed rape... https://t.co/Tb9IapSEdn;;en;MeToo;;;;;;7/16/16 19:12;instablog9ja;Instablog9ja;Fashion. Lifestyle. Entertainment. 24/7 News;37310;False;27519;65;0;1;https://t.co/G4AAN9R5pC;24;True;False;False;english;. a french porn star-turned-agony aunt who joined 99 other women condemning the #metoo movement has claimed rape... https://t.co/tb9iapsedn;. a french porn star-turned-agony aunt who joined 99 other women condemning the  movement has claimed rape... ;. french porn star-turned-agony aunt joined 99 women condemning movement claimed rape ... ;[('.', '.'), ('french', 'JJ'), ('porn', 'JJ'), ('star-turned-agony', 'JJ'), ('aunt', 'NN'), ('joined', 'VBD'), ('99', 'CD'), ('women', 'NNS'), ('condemning', 'VBG'), ('movement', 'NN'), ('claimed', 'VBD'), ('rape', 'NN'), ('...', ':')];. french porn star-turned-agoni aunt join 99 women condemn movement claim rape ...;. french porn star-turned-agony aunt join 99 woman condemn movement claim rape ...
59290;twitter;1/14/18 8:00;FALSE;"I haven't seen this show but from what I read here, a portion of UK population(and likely the US) thinks that it is ok for a trans person to shame a man for not being into a sexual advance made on him.
Can this man now proclaim himself as part of #metoo ?
Just curious. https://t.co/wzyh5y7yGy";;en;metoo;;Seattle, WA;;;;11/11/15 2:39;jess7719;WA girl 4 Trump;Once a steadfast democrat but now just independent.Regardless, this is not about party it is about draining the swamp&reclaiming our country!;59145;False;17852;13784;0;1;;73;False;False;False;english;"i have not seen this show but from what i read here, a portion of uk population(and likely the us) thinks that it is ok for a trans person to shame a man for not being into a sexual advance made on him.
can this man now proclaim himself as part of #metoo ?
just curious. https://t.co/wzyh5y7ygy";"i have not seen this show but from what i read here, a poion of uk population(and likely the us) thinks that it is ok for a trans person to shame a man for not being into a sexual advance made on him.
can this man now proclaim himself as pa of  ?
just curious. ";seen show read , poion uk population ( likely us ) thinks ok trans person shame man sexual advance made . man proclaim pa ? curious . ;[('seen', 'VBN'), ('show', 'NN'), ('read', 'NN'), (',', ','), ('poion', 'NN'), ('uk', 'JJ'), ('population', 'NN'), ('(', '('), ('likely', 'JJ'), ('us', 'PRP'), (')', ')'), ('thinks', 'VBZ'), ('ok', 'JJ'), ('trans', 'NNS'), ('person', 'NN'), ('shame', 'JJ'), ('man', 'NN'), ('sexual', 'JJ'), ('advance', 'NN'), ('made', 'VBD'), ('.', '.'), ('man', 'NN'), ('proclaim', 'NN'), ('pa', 'NN'), ('?', '.'), ('curious', 'JJ'), ('.', '.')];seen show read , poion uk popul ( like us ) think ok tran person shame man sexual advanc made . man proclaim pa ? curiou .;see show read , poion uk population ( likely u ) think ok trans person shame man sexual advance make . man proclaim pa ? curious .
59292;twitter;1/14/18 8:00;TRUE;;RT @BombshellTags: If you are a man in power with a platform and you weigh in on the #MeToo and #Timesup movement, carefully articulate you…;en;MeToo, Timesup;;;;;;11/18/08 1:02;valentine4USA;AMERICAN WOMAN;Trying to understand it all. #Peace ♥️ & #Equality please. All Tweets R my opinions. I #Resist #Bigly 🗽🇺🇸;89154;False;4048;5002;33;0;;118;False;False;False;english;rt @bombshelltags: if you are a man in power with a platform and you weigh in on the #metoo and #timesup movement, carefully articulate you…;  if you are a man in power with a platform and you weigh in on the  and  movement, carefully aiculate you…;man power platform weigh movement , carefully aiculate you… ;[('man', 'NN'), ('power', 'NN'), ('platform', 'NN'), ('weigh', 'JJ'), ('movement', 'NN'), (',', ','), ('carefully', 'RB'), ('aiculate', 'VB'), ('you…', 'NN')];man power platform weigh movement , care aicul you…;man power platform weigh movement , carefully aiculate you…
59293;twitter;1/14/18 8:00;TRUE;;RT @IOANNIS1234567: In Sweden, Not Everyone Can Say #MeToo | Zero Hedge https://t.co/DhswDpoZXq;en;MeToo;;;;;;2/5/17 7:17;IOANNIS1234567;IOANNIS1234567;;54215;False;783;1426;1;0;;3;False;False;True;english;rt @ioannis1234567: in sweden, not everyone can say #metoo | zero hedge https://t.co/dhswdpozxq;  in sweden, not everyone can say  | zero hedge ;sweden , everyone say | zero hedge ;[('sweden', 'NN'), (',', ','), ('everyone', 'NN'), ('say', 'VBP'), ('|', 'NN'), ('zero', 'CD'), ('hedge', 'NN')];sweden , everyon say | zero hedg;sweden , everyone say | zero hedge
59294;twitter;1/14/18 8:00;TRUE;;"RT @k80way: I talked to a girl who says she went on a date with @azizansari in an exclusive for @babedotnet. She told me, ""It was by far th…";en;;azizansari,babedotnet;⚜️| bts x shinee x txt;;;;9/23/16 13:41;AFROJOONS;⚔️ 𝖕𝖍𝖆𝖓𝖙𝖔𝖒 𝖙𝖍𝖎𝖊𝖋 ⚔️;#NAMJOON: I am thou, thou art I. The world is filled with both beauty and vice. It is time you teach people which is which!;102222;False;10323;5025;7821;0;;197;False;False;True;english;"rt @k80way: i talked to a girl who says she went on a date with @azizansari in an exclusive for @babedotnet. she told me, ""it was by far th…";"  i talked to a girl who says she went on a date with  in an exclusive for  she told me, ""it was by far th…";talked girl says went date exclusive told , `` far th… ;[('talked', 'VBN'), ('girl', 'NN'), ('says', 'VBZ'), ('went', 'VBD'), ('date', 'NN'), ('exclusive', 'JJ'), ('told', 'NN'), (',', ','), ('``', '``'), ('far', 'RB'), ('th…', 'JJ')];talk girl say went date exclus told , `` far th…;talk girl say go date exclusive told ,  far th…
59295;twitter;1/14/18 8:00;FALSE;Andrew Sullivan: It’s Time to Resist the Excesses of #MeToo https://t.co/BUWZhyTFTJ;;en;MeToo;;;;;;9/4/13 9:45;JJPurrs;Juni Purrs;Retired Software Quality Engineer, Cord Cutter before it was cool,  Conservative, Pro Life, Cat Lover. Above all else, is freedom!';4829;False;87;458;0;0;https://t.co/LgJIS1dSsG;8;False;False;False;english;andrew sullivan: it’s time to resist the excesses of #metoo https://t.co/buwzhytftj;andrew sullivan: it’s time to resist the excesses of  ;andrew sullivan : ’ time resist excesses ;[('andrew', 'JJ'), ('sullivan', 'NN'), (':', ':'), ('’', 'JJ'), ('time', 'NN'), ('resist', 'NN'), ('excesses', 'NNS')];andrew sullivan : ’ time resist excess;andrew sullivan : ’ time resist excess
59296;twitter;1/14/18 8:00;FALSE;not at war with men but rather with machismo culture, gender inequality and the inherent misogyny of religions. https://t.co/b88fKx5tTU;;en;;;;;;;11/15/15 10:10;ellieanstruther;eleanor anstruther;Writer. Represented by @jennysavill1 Debut novel A PERFECT EXPLANATION March 15th 2019 @saltpublishing;3856;False;481;1076;0;0;https://t.co/Fu9Y8aPIGt;6;True;False;False;english;not at war with men but rather with machismo culture, gender inequality and the inherent misogyny of religions. https://t.co/b88fkx5ttu;not at war with men but rather with machismo culture, gender inequality and the inherent misogyny of religions. ;war men rather machismo culture , gender inequality inherent misogyny religions . ;[('war', 'NN'), ('men', 'NNS'), ('rather', 'RB'), ('machismo', 'JJ'), ('culture', 'NN'), (',', ','), ('gender', 'NN'), ('inequality', 'NN'), ('inherent', 'JJ'), ('misogyny', 'NN'), ('religions', 'NNS'), ('.', '.')];war men rather machismo cultur , gender inequ inher misogyni religion .;war men rather machismo culture , gender inequality inherent misogyny religion .
59297;twitter;1/14/18 8:00;FALSE;Anyone wanna place any wagers on who will be the next celebrity to get accused of sexual harassment? #MeToo;;en;MeToo;;Somewhere where in the middle ;;;;7/17/09 16:01;JShadow6661;ℭ𝔥𝔞𝔪𝔭𝔞;Enjoying life while I can, the best way I can.;14416;False;239;1850;0;1;;1;False;False;False;english;anyone wanna place any wagers on who will be the next celebrity to get accused of sexual harassment? #metoo;anyone wanna place any wagers on who will be the next celebrity to get accused of sexual harassment? ;anyone wan na place wagers next celebrity get accused sexual harassment ? ;[('anyone', 'NN'), ('wan', 'WRB'), ('na', 'JJ'), ('place', 'NN'), ('wagers', 'NNS'), ('next', 'IN'), ('celebrity', 'NN'), ('get', 'VBP'), ('accused', 'VBN'), ('sexual', 'JJ'), ('harassment', 'NN'), ('?', '.')];anyon wan na place wager next celebr get accus sexual harass ?;anyone wan na place wager next celebrity get accuse sexual harassment ?
59298;twitter;1/14/18 8:00;FALSE;@starbuck13502 @AprilDRyan These pictures are DISGUSTING #MeToo #SheKnew https://t.co/IQdF1u23kX;;en;MeToo, SheKnew;starbuck13502,AprilDRyan;"I'll never tell!
";;;;1/7/12 4:26;JAnonymousNY;JAnon +++;Trust the Plan;8605;False;401;420;0;0;https://t.co/VIEdtGlXMN;0;False;False;False;english;@starbuck13502 @aprildryan these pictures are disgusting #metoo #sheknew https://t.co/iqdf1u23kx;  these pictures are disgusting   ;pictures disgusting ;[('pictures', 'NNS'), ('disgusting', 'VBG')];pictur disgust;picture disgust
59299;twitter;1/14/18 8:00;TRUE;;RT @CHSommers: This baseless attack on Aziz Ansari trivializes the #Metoo movement. #WitchHunt https://t.co/Z5EUhCUEZJ;en;Metoo, WitchHunt;;Seattle;;;;2/27/09 0:30;Ramabambam;Ramy Hardwick;Conservative in a blue state.  It makes me crazy!;7059;False;199;788;671;0;;3;True;False;False;english;rt @chsommers: this baseless attack on aziz ansari trivializes the #metoo movement. #witchhunt https://t.co/z5euhcuezj;  this baseless attack on aziz ansari trivializes the  movement.  ;baseless attack aziz ansari trivializes movement . ;[('baseless', 'JJ'), ('attack', 'NN'), ('aziz', 'NN'), ('ansari', 'NN'), ('trivializes', 'VBZ'), ('movement', 'NN'), ('.', '.')];baseless attack aziz ansari trivial movement .;baseless attack aziz ansari trivialize movement .
