id;source;created_date;is_retweet;text;text_retweet;language;hashtags;mentions;location;geo_location;geo_country;geo_coordinates;user_created_at;screen_name;name;profile_description;total_number_of_tweets;is_verified;followers_count;friends_count;retweets_count;favorite_count;url;listed_count;default_profile;default_profile_image;has_extended_profile;language_desc;tweet_full;pre_proc_tweet;stop_filter_tweet;pos_tags;stem_filter;lemma_filter
26539;twitter;1/26/18 5:48;TRUE;;"RT @ColorOfChange: Three black Texas A&amp;M students have developed a technology that allows you to report sexual assault anonymously. #MeToo";en;MeToo;;Remote;;;;6/15/09 16:35;FlyGuyLoic;Loïc Stephane;Just my thoughts - Right or wrong - just what I was feeling at the time. 🏀🎶🍷🇨🇲🇨🇫🇺🇸;22061;False;446;489;49;0;;8;False;False;False;english;"rt @colorofchange: three black texas a&amp;m students have developed a technology that allows you to report sexual assault anonymously. #metoo";"  three black texas a&amp;m students have developed a technology that allows you to repo sexual assault anonymously. ";"three black texas & amp ; students developed technology allows repo sexual assault anonymously . ";"[('three', 'CD'), ('black', 'JJ'), ('texas', 'NN'), ('&', 'CC'), ('amp', 'NN'), (';', ':'), ('students', 'NNS'), ('developed', 'VBD'), ('technology', 'NN'), ('allows', 'NNS'), ('repo', 'VBP'), ('sexual', 'JJ'), ('assault', 'NN'), ('anonymously', 'RB'), ('.', '.')]";"three black texa & amp ; student develop technolog allow repo sexual assault anonym .";"three black texas & amp ; student develop technology allows repo sexual assault anonymously ."
26540;twitter;1/26/18 5:48;TRUE;;RT @AngryBlackLady: Pardon me if I ignore the indignant men who have Extremely Important Opinions about Judge Aquilina when they have said…;en;;;Manchester, UK;;;;5/3/08 15:12;Akheloios;Paul 'Optimates delenda est!' Birchenough;Ancient, stooped, limping prose, also available as a body double for dead actors.;15794;False;120;477;466;0;;4;True;False;False;english;rt @angryblacklady: pardon me if i ignore the indigt men who have extremely important opinions about judge aquilina when they have said…;  pardon me if i ignore the indigt men who have extremely impoant opinions about judge aquilina when they have said…;pardon ignore indigt men extremely impoant opinions judge aquilina said… ;[('pardon', 'NN'), ('ignore', 'NN'), ('indigt', 'JJ'), ('men', 'NNS'), ('extremely', 'RB'), ('impoant', 'JJ'), ('opinions', 'NNS'), ('judge', 'VBP'), ('aquilina', 'RB'), ('said…', 'JJ')];pardon ignor indigt men extrem impoant opinion judg aquilina said…;pardon ignore indigt men extremely impoant opinion judge aquilina said…
26542;twitter;1/26/18 5:49;TRUE;;RT @Slate: Casey Affleck is skipping the Oscars, reportedly because of #MeToo: https://t.co/7PQ6Q473zF https://t.co/Joet9fazn4;en;MeToo;;;;;;8/15/12 20:27;CarlosSanSierra;Carlos SantanaSierra;ZAG-Jayhawk-World Traveler. From the Old Country, Lib Dem. Delta Sig. City on a Hill.;12795;False;636;2042;7;0;;6;True;False;False;english;rt @slate: casey affleck is skipping the oscars, reportedly because of #metoo: https://t.co/7pq6q473zf https://t.co/joet9fazn4;  casey affleck is skipping the oscars, repoedly because of   ;casey affleck skipping oscars , repoedly ;[('casey', 'NN'), ('affleck', 'NN'), ('skipping', 'VBG'), ('oscars', 'NNS'), (',', ','), ('repoedly', 'RB')];casey affleck skip oscar , repoedli;casey affleck skip oscar , repoedly
26544;twitter;1/26/18 5:49;FALSE;"#Metoo : le ""début"" d’un mouvement prometteur, pour l’icône africaine du féminisme
https://t.co/nv7DOW4Z5f https://t.co/2QzvllV6yM";;fr;Metoo;;Afrique;;;;9/2/12 10:56;AFRICA24MONDE;#AFRICA24MONDE;Compte dédié à l'information africaine 24/7 en #Afrique vers le #Monde. @Africa24Monde @A24MondeECO @A24mondeSport. #A24M #Africa #UnionAfricaine #SavoirDuMonde;31894;False;4823;209;0;0;https://t.co/13DLmk0lB9;81;False;False;False;french;"#metoo : le ""début"" d’un mouvement prometteur, pour l’icône africaine du féminisme
https://t.co/nv7dow4z5f https://t.co/2qzvllv6ym";" : le ""début"" d’un mouvement prometteur, pour l’icône africaine du féminisme
 ";: `` début '' ’ mouvement prometteur , ’ icône africaine féminisme ;[(':', ':'), ('``', '``'), ('début', 'NN'), ('``', '``'), ('’', 'JJ'), ('mouvement', 'NN'), ('prometteur', 'NN'), (',', ','), ('’', 'NNP'), ('icône', 'VBP'), ('africaine', 'NN'), ('féminisme', 'NN')];: `` début `` ’ mouvement prometteur , ’ icôn africain féminism;:  début  ’ mouvement prometteur , ’ icône africaine féminisme
26545;twitter;1/26/18 5:49;TRUE;;RT @kezamacdonald: For games industry women, it sometimes feels like we're only listened to when we're talking about our trauma. Stop peste…;en;;;Covington, WA, USA;;;;10/20/09 22:03;DodgerWA;🖕🏻Fuck White Supremacy🖕🏻;Code Monkey. Reader of fantasy. Technologically enhanced human. Secular Pagan. Sometimes I write, take pictures and/or make things.;55405;False;320;362;205;0;https://t.co/B7BjmsemDn;81;False;False;False;english;rt @kezamacdonald: for games industry women, it sometimes feels like we're only listened to when we're talking about our trauma. stop peste…;  for games industry women, it sometimes feels like we're only listened to when we're talking about our trauma. stop peste…;games industry women , sometimes feels like 're listened 're talking trauma . stop peste… ;"[('games', 'NNS'), ('industry', 'NN'), ('women', 'NNS'), (',', ','), ('sometimes', 'RB'), ('feels', 'NNS'), ('like', 'IN'), (""'re"", 'VBP'), ('listened', 'VBN'), (""'re"", 'VBP'), ('talking', 'VBG'), ('trauma', 'NN'), ('.', '.'), ('stop', 'VB'), ('peste…', 'NN')]";game industri women , sometim feel like 're listen 're talk trauma . stop peste…;game industry woman , sometimes feel like 're listen 're talk trauma . stop peste…
26546;twitter;1/26/18 5:49;TRUE;;RT @Slate: Casey Affleck is skipping the Oscars, reportedly because of #MeToo: https://t.co/7PQ6Q473zF https://t.co/Joet9fazn4;en;MeToo;;;;;;9/11/16 16:29;HaremConspiracy;Harem Conspiracy;connivers be damned;26422;False;335;3461;7;0;;13;False;False;False;english;rt @slate: casey affleck is skipping the oscars, reportedly because of #metoo: https://t.co/7pq6q473zf https://t.co/joet9fazn4;  casey affleck is skipping the oscars, repoedly because of   ;casey affleck skipping oscars , repoedly ;[('casey', 'NN'), ('affleck', 'NN'), ('skipping', 'VBG'), ('oscars', 'NNS'), (',', ','), ('repoedly', 'RB')];casey affleck skip oscar , repoedli;casey affleck skip oscar , repoedly
26547;twitter;1/26/18 5:49;TRUE;;"RT @Telegraph: Indonesian woman's clip of street groping goes viral in Muslim country's #MeToo moment
https://t.co/iNXFzC5aPx https://t.co/…";en;MeToo;;;;;;3/7/14 9:19;umairahjannah;Nursabrina;Food is bae😍;2618;False;33;100;51;0;;0;False;False;True;english;"rt @telegraph: indonesian woman's clip of street groping goes viral in muslim country's #metoo moment
https://t.co/inxfzc5apx https://t.co/…";"  indonesian woman's clip of street groping goes viral in muslim country's  moment
 ";indonesian woman 's clip street groping goes viral muslim country 's moment ;"[('indonesian', 'JJ'), ('woman', 'NN'), (""'s"", 'POS'), ('clip', 'JJ'), ('street', 'NN'), ('groping', 'NN'), ('goes', 'VBZ'), ('viral', 'JJ'), ('muslim', 'JJ'), ('country', 'NN'), (""'s"", 'POS'), ('moment', 'NN')]";indonesian woman 's clip street grope goe viral muslim countri 's moment;indonesian woman 's clip street groping go viral muslim country 's moment
26548;twitter;1/26/18 5:49;FALSE;"“All these brave women have power, &amp; we will use our voices to make sure you get what you deserve: A life of suffering spent replaying the words delivered by this powerful army of survivors.” - @Aly_Raisman 
#TimesUp #MeToo #Survivors https://t.co/M377W71BIR";;en;TimesUp, MeToo, Survivors;Aly_Raisman;Brooklyn, NY;Brooklyn, NY;;;1/26/12 3:55;TaylorFeuss;Taylor Feuss;marketing+comms | writer | mental health blogger | designer | lover of gel pens & pineapple on pizza;3587;False;679;2306;0;1;https://t.co/hAp74FMGAm;15;False;False;True;english;"“all these brave women have power, &amp; we will use our voices to make sure you get what you deserve: a life of suffering spent replaying the words delivered by this powerful army of survivors.” - @aly_raisman 
#timesup #metoo #survivors https://t.co/m377w71bir";"“all these brave women have power, &amp; we will use our voices to make sure you get what you deserve: a life of suffering spent replaying the words delivered by this powerful army of survivors.” -  
   ";"“ brave women power , & amp ; use voices make sure get deserve : life suffering spent replaying words delivered powerful army survivors. ” - ";"[('“', 'NNS'), ('brave', 'VBP'), ('women', 'NNS'), ('power', 'NN'), (',', ','), ('&', 'CC'), ('amp', 'NN'), (';', ':'), ('use', 'NN'), ('voices', 'NNS'), ('make', 'VBP'), ('sure', 'JJ'), ('get', 'VB'), ('deserve', 'NN'), (':', ':'), ('life', 'NN'), ('suffering', 'VBG'), ('spent', 'JJ'), ('replaying', 'VBG'), ('words', 'NNS'), ('delivered', 'VBN'), ('powerful', 'JJ'), ('army', 'NN'), ('survivors', 'NNS'), ('.', '.'), ('”', 'SYM'), ('-', ':')]";"“ brave women power , & amp ; use voic make sure get deserv : life suffer spent replay word deliv power armi survivor . ” -";" brave woman power , & amp ; use voice make sure get deserve : life suffer spent replay word deliver powerful army survivor .  -"
26549;twitter;1/26/18 5:49;TRUE;;"RT @fanniesroom: You know #metoo hasn't gone near far enough when ""that lady judge should've been nicer to that guy who assaulted more than…";en;metoo;;Akron, OH;;;;7/12/12 21:51;Laciiieee;Raegan;Barista || Twenty-Fun || Dog Mom🐾🐶 || DMS🥰;41547;False;572;618;8616;0;;3;False;False;True;english;"rt @fanniesroom: you know #metoo hasn't gone near far enough when ""that lady judge should've been nicer to that guy who assaulted more than…";"  you know  hasn't gone near far enough when ""that lady judge should've been nicer to that guy who assaulted more than…";know n't gone near far enough `` lady judge 've nicer guy assaulted than… ;"[('know', 'VBP'), (""n't"", 'RB'), ('gone', 'VBN'), ('near', 'RB'), ('far', 'RB'), ('enough', 'JJ'), ('``', '``'), ('lady', 'JJ'), ('judge', 'NN'), (""'ve"", 'VBP'), ('nicer', 'VBN'), ('guy', 'NN'), ('assaulted', 'VBN'), ('than…', 'NN')]";know n't gone near far enough `` ladi judg 've nicer guy assault than…;know n't go near far enough  lady judge 've nicer guy assault than…
26550;twitter;1/26/18 5:49;FALSE;In wake of #MeToo and #TimesUp, Casey Affleck decides not to... , https://t.co/HLLXZvk61P https://t.co/BSnCgHUam3;;en;MeToo, TimesUp;;DKI Jakarta;;;;9/9/09 6:07;jspchristian;Joseph Christian;Thinker, Stocks Trader, Creative Designer, Photographer.;39795;False;194;239;0;0;https://t.co/2VjF8EswyB;4;False;False;True;english;in wake of #metoo and #timesup, casey affleck decides not to... , https://t.co/hllxzvk61p https://t.co/bsncghuam3;in wake of  and  casey affleck decides not to... ,  ;wake casey affleck decides ... , ;[('wake', 'NN'), ('casey', 'NN'), ('affleck', 'NN'), ('decides', 'NNS'), ('...', ':'), (',', ',')];wake casey affleck decid ... ,;wake casey affleck decides ... ,
26551;twitter;1/26/18 5:49;TRUE;;RT @Slate: Casey Affleck is skipping the Oscars, reportedly because of #MeToo: https://t.co/7PQ6Q473zF https://t.co/Joet9fazn4;en;MeToo;;Lisbon, Portugal;;;;3/7/14 7:36;Zittiribit;Zittiribit;;10788;False;139;709;7;0;;4;False;False;False;english;rt @slate: casey affleck is skipping the oscars, reportedly because of #metoo: https://t.co/7pq6q473zf https://t.co/joet9fazn4;  casey affleck is skipping the oscars, repoedly because of   ;casey affleck skipping oscars , repoedly ;[('casey', 'NN'), ('affleck', 'NN'), ('skipping', 'VBG'), ('oscars', 'NNS'), (',', ','), ('repoedly', 'RB')];casey affleck skip oscar , repoedli;casey affleck skip oscar , repoedly
26552;twitter;1/26/18 5:49;FALSE;#CaseyAffleck no asistirá al Oscar, ni entregará premio a mejor actriz https://t.co/JhGiycgSPV #MeToo;;es;CaseyAffleck, MeToo;;México;;;;1/20/08 6:32;JulioVelez;Julio Velez;Crítico de Cine, TV, games, tech y anime/manga. Reportero del #Doblaje. Otaku/Warsie/Trekkie/Whovian. Editor anime y manga en @CinePREMIERE;64066;True;7462;1238;2;2;https://t.co/kW16udVVdf;116;False;False;True;spanish;#caseyaffleck no asistirá al oscar, ni entregará premio a mejor actriz https://t.co/jhgiycgspv #metoo; no asistirá al oscar, ni entregará premio a mejor actriz  ;asistirá oscar , entregará premio mejor actriz ;[('asistirá', 'NN'), ('oscar', 'NN'), (',', ','), ('entregará', 'JJ'), ('premio', 'NN'), ('mejor', 'NN'), ('actriz', 'NN')];asistirá oscar , entregará premio mejor actriz;asistirá oscar , entregará premio mejor actriz
26553;twitter;1/26/18 5:49;TRUE;;RT @meduza_en: Russia doesn't have the #MeToo movement, but it does have the #ЭтоНеПоводУбить (“This is no excuse for murder”) flashmob, an…;en;MeToo, ЭтоНеПоводУбить;;Moscow;;;;1/25/12 18:26;Andrico21;Kirill Andrienko;;114028;False;199;91;65;0;;32;True;False;False;english;rt @meduza_en: russia does not have the #metoo movement, but it does have the #этонеповодубить (“this is no excuse for murder”) flashmob, an…;  russia does not have the  movement, but it does have the  (“this is no excuse for murder”) flashmob, an…;russia movement , ( “ excuse murder ” ) flashmob , an… ;[('russia', 'NN'), ('movement', 'NN'), (',', ','), ('(', '('), ('“', 'JJ'), ('excuse', 'NN'), ('murder', 'NN'), ('”', 'NN'), (')', ')'), ('flashmob', 'NN'), (',', ','), ('an…', 'NN')];russia movement , ( “ excus murder ” ) flashmob , an…;russia movement , (  excuse murder  ) flashmob , an…
26554;twitter;1/26/18 5:49;FALSE;@marcasil Irresponsable usted! Acuérdese que estamos en un mundo “globalizado” y en el mundo🌍 No su (barriesito o su calle) existe un movimiento importante para las Mujeres por cierto #MeToo puede Googlear... ud es la que saca de contexto la columna! #solidaridadfemenina;;es;MeToo, solidaridadfemenina;marcasil;Mexico df - Bogota & otros;;;;11/5/10 5:03;luzhelenaospina;Luz Helena;;2183;False;1088;2125;0;0;;9;True;False;False;spanish;@marcasil irresponsable usted! acuérdese que estamos en un mundo “globalizado” y en el mundo🌍 no su (barriesito o su calle) existe un movimiento importante para las mujeres por cierto #metoo puede googlear... ud es la que saca de contexto la columna! #solidaridadfemenina; irresponsable usted! acuérdese que estamos en un mundo “globalizado” y en el mundo🌍 no su (barriesito o su calle) existe un movimiento impoante para las mujeres por cieo  puede googlear... ud es la que saca de contexto la columna! ;irresponsable usted ! acuérdese mundo “ globalizado ” mundo🌍 ( barriesito calle ) existe movimiento impoante mujeres cieo puede googlear ... ud saca contexto columna ! ;[('irresponsable', 'JJ'), ('usted', 'JJ'), ('!', '.'), ('acuérdese', 'JJ'), ('mundo', 'NN'), ('“', 'NNP'), ('globalizado', 'NN'), ('”', 'NNP'), ('mundo🌍', 'NN'), ('(', '('), ('barriesito', 'JJ'), ('calle', 'NN'), (')', ')'), ('existe', 'NN'), ('movimiento', 'NN'), ('impoante', 'NN'), ('mujeres', 'NNS'), ('cieo', 'VBP'), ('puede', 'JJ'), ('googlear', 'NN'), ('...', ':'), ('ud', 'JJ'), ('saca', 'NN'), ('contexto', 'NN'), ('columna', 'NN'), ('!', '.')];irrespons ust ! acuérdes mundo “ globalizado ” mundo🌍 ( barriesito call ) exist movimiento impoant mujer cieo pued googlear ... ud saca contexto columna !;irresponsable usted ! acuérdese mundo  globalizado  mundo🌍 ( barriesito calle ) existe movimiento impoante mujeres cieo puede googlear ... ud saca contexto columna !
26555;twitter;1/26/18 5:49;TRUE;;"RT @TheAffinityMag: Three black Texas A&amp;M students have developed a technology that allows you to report sexual assault anonymously. #MeToo…";en;MeToo;;;;;;7/21/11 19:42;thebrittnirodio;Brittni Rodio;;13998;False;287;249;8077;0;;1;False;False;True;english;"rt @theaffinitymag: three black texas a&amp;m students have developed a technology that allows you to report sexual assault anonymously. #metoo…";"  three black texas a&amp;m students have developed a technology that allows you to repo sexual assault anonymously. ";"three black texas & amp ; students developed technology allows repo sexual assault anonymously . ";"[('three', 'CD'), ('black', 'JJ'), ('texas', 'NN'), ('&', 'CC'), ('amp', 'NN'), (';', ':'), ('students', 'NNS'), ('developed', 'VBD'), ('technology', 'NN'), ('allows', 'NNS'), ('repo', 'VBP'), ('sexual', 'JJ'), ('assault', 'NN'), ('anonymously', 'RB'), ('.', '.')]";"three black texa & amp ; student develop technolog allow repo sexual assault anonym .";"three black texas & amp ; student develop technology allows repo sexual assault anonymously ."
26556;twitter;1/26/18 5:50;TRUE;;RT @RotNScoundrel: If Nancy Pelosi wears a #MeToo black dress to Trump's State of the Union we'll see what Wednesday Addams would look like…;en;MeToo;;;;;;10/14/13 23:42;jaushouse;StatusQuoContrarian;Trying to make it through each day. Typically with coffee and sarcasm.;31108;False;630;1577;82;0;;13;True;False;False;english;rt @rotnscoundrel: if nancy pelosi wears a #metoo black dress to trump's state of the union we'll see what wednesday addams would look like…;  if nancy pelosi wears a  black dress to trump's state of the union we'll see what wednesday addams would look like…;nancy pelosi wears black dress trump 's state union 'll see wednesday addams would look like… ;"[('nancy', 'NN'), ('pelosi', 'NN'), ('wears', 'VBZ'), ('black', 'JJ'), ('dress', 'NN'), ('trump', 'NN'), (""'s"", 'POS'), ('state', 'NN'), ('union', 'NN'), (""'ll"", 'MD'), ('see', 'VB'), ('wednesday', 'JJ'), ('addams', 'NNS'), ('would', 'MD'), ('look', 'VB'), ('like…', 'NN')]";nanci pelosi wear black dress trump 's state union 'll see wednesday addam would look like…;nancy pelosi wear black dress trump 's state union 'll see wednesday addams would look like…
26557;twitter;1/26/18 5:50;TRUE;;RT @mredshirtshaw: This is an epidemic, and #MeToo is only effective if our stories are centered. Now. #MMIW #MMIWG #AmINext;en;MeToo, MMIW, MMIWG, AmINext;;Houston, TX;;;;9/12/12 17:30;Joweeezy;Joey Tovar;Guardian of Profound Peace✌️🏽❤️                       Mexican 🇲🇽 Writer 📖🖋️;71362;False;219;828;15;0;https://t.co/dnttskdXu3;145;False;False;True;english;rt @mredshirtshaw: this is an epidemic, and #metoo is only effective if our stories are centered. now. #mmiw #mmiwg #aminext;  this is an epidemic, and  is only effective if our stories are centered. now.   ;epidemic , effective stories centered . . ;[('epidemic', 'JJ'), (',', ','), ('effective', 'JJ'), ('stories', 'NNS'), ('centered', 'VBN'), ('.', '.'), ('.', '.')];epidem , effect stori center . .;epidemic , effective story center . .
26558;twitter;1/26/18 5:50;FALSE;Casey Affleck is skipping the Oscars, reportedly because of #MeToo: https://t.co/ADLmCsT1iN;;en;MeToo;;Colombia;;;;10/5/14 10:33;JaimeRelajado;Jaime P Paz;Toooodo con suaaavennnna...traaanquilidaaaaad nuñez;107525;False;592;99;0;0;;22;False;False;False;english;casey affleck is skipping the oscars, reportedly because of #metoo: https://t.co/adlmcst1in;casey affleck is skipping the oscars, repoedly because of  ;casey affleck skipping oscars , repoedly ;[('casey', 'NN'), ('affleck', 'NN'), ('skipping', 'VBG'), ('oscars', 'NNS'), (',', ','), ('repoedly', 'RB')];casey affleck skip oscar , repoedli;casey affleck skip oscar , repoedly
26559;twitter;1/26/18 5:50;TRUE;;RT @CHSommers: Matt Damon made some perfectly reasonable remarks about the need for distinctions and nuance in the  #Metoo reckoning. The S…;en;Metoo;;Deep Sky;;;;12/1/09 19:08;djinncangan;Annihilator Archon;Actually have overwhelming power.;19907;False;218;344;240;0;https://t.co/dvOlEmyKB4;7;True;False;False;english;rt @chsommers: matt damon made some perfectly reasonable remarks about the need for distinctions and nuance in the  #metoo reckoning. the s…;  matt damon made some perfectly reasonable remarks about the need for distinctions and nuance in the   reckoning. the s…;matt damon made perfectly reasonable remarks need distinctions nuance reckoning . s… ;[('matt', 'NN'), ('damon', 'NN'), ('made', 'VBD'), ('perfectly', 'RB'), ('reasonable', 'JJ'), ('remarks', 'NNS'), ('need', 'VBP'), ('distinctions', 'NNS'), ('nuance', 'RB'), ('reckoning', 'VBG'), ('.', '.'), ('s…', 'NN')];matt damon made perfectli reason remark need distinct nuanc reckon . s…;matt damon make perfectly reasonable remark need distinction nuance reckon . s…
26560;twitter;1/26/18 5:50;TRUE;;RT @LiveAction: Planned Parenthood is not qualified to speak out against sexual abuse. The abortion corporation routinely covers up child s…;en;;;Phoenix, AZ;;;;9/3/17 18:22;Roxiepurgatory;rm;;93580;False;657;125;376;0;;1;True;False;False;english;rt @liveaction: planned parenthood is not qualified to speak out against sexual abuse. the abortion corporation routinely covers up child s…;  planned parenthood is not qualified to speak out against sexual abuse. the aboion corporation routinely covers up child s…;planned parenthood qualified speak sexual abuse . aboion corporation routinely covers child s… ;[('planned', 'VBN'), ('parenthood', 'NN'), ('qualified', 'VBN'), ('speak', 'JJ'), ('sexual', 'JJ'), ('abuse', 'NN'), ('.', '.'), ('aboion', 'NN'), ('corporation', 'NN'), ('routinely', 'RB'), ('covers', 'VBZ'), ('child', 'JJ'), ('s…', 'NN')];plan parenthood qualifi speak sexual abus . aboion corpor routin cover child s…;plan parenthood qualify speak sexual abuse . aboion corporation routinely cover child s…
26562;twitter;1/26/18 5:50;TRUE;;RT @MollyRoseTarpey: Can we get Judge Rosemarie Aquilina to read Courtland Sykes' statement out loud and then throw it away like she did La…;en;;;The Greatest Nation on Earth;;;;4/8/11 15:25;HiMaui;HiMaui🌺🇵🇷✨;🚨READ•HELSINKI•TRANSCRIPT 💜HeatherHeyer💜KHASHOGGI💙#MSDStrong💙116th 🇺🇸Brava Pelosi🇺🇸 R E L E A S E * T H E * F U L L * R E P O R T *;180053;False;7444;3270;67;0;;27;False;False;False;english;rt @mollyrosetarpey: can we get judge rosemarie aquilina to read courtland sykes' statement out loud and then throw it away like she did la…;  can we get judge rosemarie aquilina to read couland sykes' statement out loud and then throw it away like she did la…;get judge rosemarie aquilina read couland sykes ' statement loud throw away like la… ;"[('get', 'VB'), ('judge', 'NN'), ('rosemarie', 'NN'), ('aquilina', 'NN'), ('read', 'VBD'), ('couland', 'NN'), ('sykes', 'NNS'), (""'"", 'POS'), ('statement', 'NN'), ('loud', 'NN'), ('throw', 'VB'), ('away', 'RB'), ('like', 'IN'), ('la…', 'NN')]";get judg rosemari aquilina read couland syke ' statement loud throw away like la…;get judge rosemarie aquilina read couland sykes ' statement loud throw away like la…
26563;twitter;1/26/18 5:50;TRUE;;"RT @fanniesroom: You know #metoo hasn't gone near far enough when ""that lady judge should've been nicer to that guy who assaulted more than…";en;metoo;;Las Vegas, NV;;;;6/22/13 22:05;lilxhannah_;morgue 🕷;morbid 🔪;33472;False;1948;1782;8616;0;;8;True;False;False;english;"rt @fanniesroom: you know #metoo hasn't gone near far enough when ""that lady judge should've been nicer to that guy who assaulted more than…";"  you know  hasn't gone near far enough when ""that lady judge should've been nicer to that guy who assaulted more than…";know n't gone near far enough `` lady judge 've nicer guy assaulted than… ;"[('know', 'VBP'), (""n't"", 'RB'), ('gone', 'VBN'), ('near', 'RB'), ('far', 'RB'), ('enough', 'JJ'), ('``', '``'), ('lady', 'JJ'), ('judge', 'NN'), (""'ve"", 'VBP'), ('nicer', 'VBN'), ('guy', 'NN'), ('assaulted', 'VBN'), ('than…', 'NN')]";know n't gone near far enough `` ladi judg 've nicer guy assault than…;know n't go near far enough  lady judge 've nicer guy assault than…
26564;twitter;1/26/18 5:50;TRUE;;RT @publico_es: Casey Affleck no entregará el Óscar a la mejor actriz por las protestas por un presunto caso de acoso sexual https://t.co/z…;es;;;;;;;8/29/15 12:26;solet72;Ester Gimbernat 🎗;Ni ens aturarem ni ens aturaran 🎗;85287;False;206;139;6;0;;4;True;False;True;spanish;rt @publico_es: casey affleck no entregará el óscar a la mejor actriz por las protestas por un presunto caso de acoso sexual https://t.co/z…;  casey affleck no entregará el óscar a la mejor actriz por las protestas por un presunto caso de acoso sexual ;casey affleck entregará óscar mejor actriz protestas presunto caso acoso sexual ;[('casey', 'NN'), ('affleck', 'NN'), ('entregará', 'NN'), ('óscar', 'NN'), ('mejor', 'NN'), ('actriz', 'NN'), ('protestas', 'NNS'), ('presunto', 'VBP'), ('caso', 'JJ'), ('acoso', 'NN'), ('sexual', 'JJ')];casey affleck entregará óscar mejor actriz protesta presunto caso acoso sexual;casey affleck entregará óscar mejor actriz protestas presunto caso acoso sexual
